hotel_stay_id,hotel_booking_id,room_type,bed_type,rating,review_text
HS07567,HB07567,Suite,Single,5,Site sport a from.
HS07568,HB07568,Deluxe,Single,2,Open serve yet positive.
HS07569,HB07569,Deluxe,King,1,Everyone middle name month nature push.
HS07570,HB07570,Standard,Double,5,Me skill best allow mention think.
HS07571,HB07571,Deluxe,King,2,Certainly central serve last.
HS07572,HB07572,Suite,Double,1,Scientist yourself church operation always direction who.
HS07573,HB07573,Standard,Double,4,Realize attorney may simple friend body media.
HS07574,HB07574,Suite,King,4,Test forward law east property stand box.
HS07575,HB07575,Standard,King,5,Natural design life east art word.
HS07576,HB07576,Deluxe,Single,4,Instead song onto thank piece six.
HS07577,HB07577,Standard,Single,4,Positive too enter project space.
HS07578,HB07578,Deluxe,King,5,Task soon do green develop behind.
HS07579,HB07579,Deluxe,Double,1,Base look sister look.
HS07580,HB07580,Deluxe,King,1,Ask finally explain bill.
HS07581,HB07581,Suite,King,1,Price themselves fly add current along front.
HS07582,HB07582,Suite,King,1,Fund else entire.
HS07583,HB07583,Deluxe,Single,5,Scene anyone onto quality president seven.
HS07584,HB07584,Suite,Single,3,Instead blood or ready.
HS07585,HB07585,Suite,Single,1,Chair career truth significant firm tough.
HS07586,HB07586,Standard,King,3,Religious own modern agency.
HS07587,HB07587,Standard,Double,4,Eat sometimes anyone knowledge any.
HS07588,HB07588,Standard,Single,2,Language break us reflect care.
HS07589,HB07589,Deluxe,King,4,Research service case soldier mother.
HS07590,HB07590,Deluxe,King,2,Win training help fine nearly.
HS07591,HB07591,Suite,Single,2,Site across give stock.
HS07592,HB07592,Deluxe,Single,3,Day travel then dog.
HS07593,HB07593,Suite,Double,2,Son name law let.
HS07594,HB07594,Deluxe,Double,1,Energy interview but growth.
HS07595,HB07595,Standard,King,1,True inside both green option position contain.
HS07596,HB07596,Suite,Double,3,Month our state central brother alone.
HS07597,HB07597,Deluxe,Double,4,Just I window.
HS07598,HB07598,Standard,King,3,Sell cell major your general beat ever purpose.
HS07599,HB07599,Deluxe,Double,4,Tough shoulder situation.
HS07600,HB07600,Suite,King,1,Too could though evening bed return hear.
HS07601,HB07601,Suite,King,4,Unit themselves if.
HS07602,HB07602,Deluxe,Double,3,Card change then.
HS07603,HB07603,Deluxe,King,2,Until direction million enter.
HS07604,HB07604,Standard,King,1,Community main only look capital watch.
HS07605,HB07605,Standard,Single,4,Fast change receive kid believe.
HS07606,HB07606,Standard,King,3,Degree subject method theory alone baby.
HS07607,HB07607,Suite,King,5,Hit pretty which that in.
HS07608,HB07608,Standard,Single,5,Hour instead involve strong.
HS07609,HB07609,Standard,Single,4,Sing agree medical father appear call here.
HS07610,HB07610,Suite,Double,5,Effect debate increase account through area.
HS07611,HB07611,Deluxe,King,5,Physical past light much.
HS07612,HB07612,Deluxe,King,5,As son best heart four top.
HS07613,HB07613,Standard,King,5,Staff report enter voice program role.
HS07614,HB07614,Suite,King,3,Hold thank especially threat probably on.
HS07615,HB07615,Deluxe,Double,5,Local political rise rule.
HS07616,HB07616,Standard,Single,3,Tree raise last partner check cut.
HS07617,HB07617,Standard,Single,5,End happy while.
HS07618,HB07618,Suite,King,2,Discuss according leave window site four.
HS07619,HB07619,Suite,King,1,Happy change bit point enjoy.
HS07620,HB07620,Suite,Single,4,What quality upon every involve produce yard.
HS07621,HB07621,Deluxe,Double,1,Several building employee control thank road.
HS07622,HB07622,Suite,Double,3,Life break near military throughout list soon every.
HS07623,HB07623,Standard,Double,1,Dinner read center begin.
HS07624,HB07624,Standard,King,5,Half unit data movie.
HS07625,HB07625,Suite,Single,4,Popular coach look cold.
HS07626,HB07626,Suite,Single,2,Energy material early.
HS07627,HB07627,Standard,Single,4,Visit improve reality.
HS07628,HB07628,Standard,King,5,Price central response thank.
HS07629,HB07629,Suite,King,3,Happy attention particularly.
HS07630,HB07630,Deluxe,Double,3,Despite his thousand role third water card.
HS07631,HB07631,Standard,Double,5,Sport station apply they eat service claim.
HS07632,HB07632,Standard,King,5,Write card expect room claim trade improve.
HS07633,HB07633,Suite,Double,1,Party very turn dark behind rule state special.
HS07634,HB07634,Deluxe,Double,3,Me case color style standard the.
HS07635,HB07635,Standard,Single,1,Product writer life.
HS07636,HB07636,Standard,King,2,Office measure lose likely increase final.
HS07637,HB07637,Deluxe,Single,1,Rise trial staff bit dog analysis add.
HS07638,HB07638,Deluxe,Single,5,Certainly let claim.
HS07639,HB07639,Suite,Single,1,Possible approach always million like star too pattern.
HS07640,HB07640,Deluxe,Single,1,Data camera office bad create.
HS07641,HB07641,Standard,King,4,Improve happen important again.
HS07642,HB07642,Deluxe,King,2,Contain into particular during beautiful wide day.
HS07643,HB07643,Deluxe,Single,1,Model response present factor person itself.
HS07644,HB07644,Standard,Single,5,Light give mind message true.
HS07645,HB07645,Suite,Double,2,How leg discuss like list decide.
HS07646,HB07646,Standard,King,3,Dinner serve long strong physical network not time.
HS07647,HB07647,Suite,King,3,Carry act above difficult leg produce.
HS07648,HB07648,Suite,King,4,Necessary move toward protect.
HS07649,HB07649,Deluxe,Double,2,Score figure reveal hand choice pretty.
HS07650,HB07650,Standard,Double,1,Political record general after party town drop.
HS07651,HB07651,Deluxe,Double,2,Girl southern father.
HS07652,HB07652,Deluxe,Single,4,Goal course minute child customer such.
HS07653,HB07653,Suite,Single,2,Son collection plant region usually.
HS07654,HB07654,Standard,Single,2,Myself rise tree choose put necessary hundred.
HS07655,HB07655,Suite,Single,3,Hit they detail social where media action.
HS07656,HB07656,Deluxe,King,5,And second spring explain.
HS07657,HB07657,Suite,Single,1,Move range would human these deal born according.
HS07658,HB07658,Standard,Double,4,Test region understand court.
HS07659,HB07659,Deluxe,King,1,While cover subject person.
HS07660,HB07660,Suite,King,4,His remain manage election business seek society.
HS07661,HB07661,Suite,Double,4,Tree adult mention.
HS07662,HB07662,Standard,Single,2,Myself only thing finally.
HS07663,HB07663,Suite,Single,5,Morning standard dog behind somebody.
HS07664,HB07664,Suite,Single,4,Measure shake adult situation once.
HS07665,HB07665,Deluxe,Single,3,Detail ahead science summer decision.
HS07666,HB07666,Deluxe,King,2,Next trip of bad yard environment.
HS07667,HB07667,Suite,Double,3,Sport movement stage modern where onto foot.
HS07668,HB07668,Deluxe,King,4,Group hour bank.
HS07669,HB07669,Standard,Double,1,Growth social those room.
HS07670,HB07670,Deluxe,Double,5,All grow stock.
HS07671,HB07671,Suite,Double,2,Figure serve economic wear crime.
HS07672,HB07672,Standard,Double,4,End eat security life picture.
HS07673,HB07673,Suite,King,3,So set husband dream ball Republican crime.
HS07674,HB07674,Suite,Single,2,Industry smile student field board.
HS07675,HB07675,Standard,Single,1,Under beat agency.
HS07676,HB07676,Deluxe,Single,5,Seven of practice list.
HS07677,HB07677,Standard,King,3,Decide fear federal off value scene.
HS07678,HB07678,Standard,Double,5,Per save strong window.
HS07679,HB07679,Deluxe,Double,5,Mind high military control child.
HS07680,HB07680,Suite,King,1,Son as support available long pattern able.
HS07681,HB07681,Deluxe,King,4,While ask class skill across two.
HS07682,HB07682,Deluxe,Double,2,Class take parent couple anyone him hard.
HS07683,HB07683,Standard,Single,4,Away tax room itself.
HS07684,HB07684,Standard,Double,3,Compare method western.
HS07685,HB07685,Standard,Double,5,Window everybody life market lot bar.
HS07686,HB07686,Suite,King,1,Exist what recent trade ability.
HS07687,HB07687,Suite,King,3,Good accept west someone family.
HS07688,HB07688,Standard,Single,2,Center understand adult service trial meeting.
HS07689,HB07689,Standard,Double,2,West whether than.
HS07690,HB07690,Deluxe,King,4,Four common race small fish thousand ready.
HS07691,HB07691,Deluxe,Single,5,Issue both make just series.
HS07692,HB07692,Standard,Double,3,Boy offer participant interview particular beat in.
HS07693,HB07693,Deluxe,Double,1,Available power alone relate three eye.
HS07694,HB07694,Deluxe,Double,3,West Republican full huge week audience difficult.
HS07695,HB07695,Standard,Double,2,Little around economic cup available.
HS07696,HB07696,Deluxe,Single,4,Join guy city knowledge plant religious themselves.
HS07697,HB07697,Standard,Double,3,Experience argue born participant situation very.
HS07698,HB07698,Deluxe,Double,5,Example decide standard friend state before environmental.
HS07699,HB07699,Suite,Double,2,Father lose coach wrong.
HS07700,HB07700,Standard,King,3,Kitchen program prevent gun prove soldier.
HS07701,HB07701,Suite,Double,3,Son table each street.
HS07702,HB07702,Standard,Double,5,Leg behavior final small sort concern we.
HS07703,HB07703,Suite,Double,3,Affect ability again sea her carry general.
HS07704,HB07704,Deluxe,Double,4,Interview off to couple country.
HS07705,HB07705,Suite,Double,4,Interest whatever full sport local song color.
HS07706,HB07706,Suite,King,2,Medical source inside more I.
HS07707,HB07707,Deluxe,Single,2,Front happen consider bill operation foreign.
HS07708,HB07708,Suite,King,1,Door trial our certain avoid environment alone.
HS07709,HB07709,Suite,Double,1,Experience per cover different effort.
HS07710,HB07710,Deluxe,Double,5,Only really school method fast door collection.
HS07711,HB07711,Deluxe,Double,1,Draw try cost pattern institution show.
HS07712,HB07712,Deluxe,Single,2,View break clearly figure later.
HS07713,HB07713,Deluxe,Double,5,Seek family prevent hotel budget.
HS07714,HB07714,Suite,Double,1,Moment art goal until benefit see.
HS07715,HB07715,Deluxe,Single,5,Event clearly though picture affect research.
HS07716,HB07716,Suite,Single,5,Whom American economy sort.
HS07717,HB07717,Suite,Double,1,Various now eat.
HS07718,HB07718,Deluxe,Single,4,Both send watch send such assume traditional continue.
HS07719,HB07719,Deluxe,Double,4,Sense group easy hospital.
HS07720,HB07720,Standard,Single,4,Stock personal this administration expert indicate wait.
HS07721,HB07721,Deluxe,Double,4,Now garden win.
HS07722,HB07722,Deluxe,Single,4,Man attorney already write recent.
HS07723,HB07723,Suite,Double,1,Story art west.
HS07724,HB07724,Deluxe,King,2,Vote dark instead.
HS07725,HB07725,Suite,Single,2,Attack pass fine industry seek because marriage.
HS07726,HB07726,Suite,Double,2,Large year save.
HS07727,HB07727,Suite,Double,4,High represent lot should.
HS07728,HB07728,Suite,Single,4,Oil past simply mean line these.
HS07729,HB07729,Standard,Double,2,Challenge four provide entire put form.
HS07730,HB07730,Standard,King,1,Receive thousand full wall true.
HS07731,HB07731,Deluxe,Double,4,Pass kind end market major too employee manager.
HS07732,HB07732,Suite,Single,4,Capital vote you might people author ten.
HS07733,HB07733,Suite,King,5,Stand decade course great develop development.
HS07734,HB07734,Suite,Double,3,Left box play most science represent always.
HS07735,HB07735,Deluxe,Double,1,Professor dream deal store mind bank stop owner.
HS07736,HB07736,Standard,Double,4,Foreign knowledge trouble purpose another fire.
HS07737,HB07737,Suite,Double,4,Face of grow wall camera.
HS07738,HB07738,Suite,Single,5,My operation yes maybe stay understand son.
HS07739,HB07739,Standard,Double,3,Officer body under just.
HS07740,HB07740,Suite,Single,4,Its admit court senior.
HS07741,HB07741,Suite,Double,1,College me prove size yeah still modern.
HS07742,HB07742,Suite,Single,3,Life drug hold though.
HS07743,HB07743,Deluxe,King,2,Image behind parent debate.
HS07744,HB07744,Suite,Double,3,Way form mention.
HS07745,HB07745,Standard,King,4,Local song operation better teacher wear.
HS07746,HB07746,Standard,Double,5,Reach drop question eight.
HS07747,HB07747,Standard,Single,3,Check author young interview outside let trouble.
HS07748,HB07748,Suite,Single,1,Draw air partner brother receive.
HS07749,HB07749,Suite,Double,5,A wonder serve population and fund.
HS07750,HB07750,Standard,King,3,American continue open short later quite late short.
HS07751,HB07751,Deluxe,Single,2,Heavy end modern about rule.
HS07752,HB07752,Standard,King,5,Apply fall again mention inside everybody.
HS07753,HB07753,Suite,Single,4,Stop ok ok go page have.
HS07754,HB07754,Deluxe,King,2,Occur establish security space.
HS07755,HB07755,Standard,Double,4,Stand agree necessary oil hit pay fact.
HS07756,HB07756,Suite,Single,4,Read cover player nature head everything.
HS07757,HB07757,Deluxe,Double,4,Institution organization husband image.
HS07758,HB07758,Standard,Double,5,Data report certainly buy popular week.
HS07759,HB07759,Suite,King,3,Believe blue feel image try sit.
HS07760,HB07760,Standard,Double,3,Close wonder often course.
HS07761,HB07761,Suite,Double,4,Worry exist federal.
HS07762,HB07762,Suite,Single,3,Power sit eight.
HS07763,HB07763,Deluxe,Double,4,College concern daughter prove community.
HS07764,HB07764,Suite,Single,1,After real both loss.
HS07765,HB07765,Deluxe,Single,3,Raise box way day music land window edge.
HS07766,HB07766,Suite,Double,3,Task once production sister.
HS07767,HB07767,Deluxe,King,2,Yeah high fall interesting why.
HS07768,HB07768,Deluxe,King,1,Health recognize decision series candidate.
HS07769,HB07769,Deluxe,King,3,Fly you memory administration war firm own.
HS07770,HB07770,Deluxe,Double,5,Finally everything into job.
HS07771,HB07771,Standard,Double,5,Behavior themselves human black woman film.
HS07772,HB07772,Deluxe,Single,3,Approach black build sure hundred page reflect.
HS07773,HB07773,Standard,Single,4,Such treatment party democratic fish present go.
HS07774,HB07774,Suite,Double,2,Student outside nation body.
HS07775,HB07775,Deluxe,King,4,Enough long break from.
HS07776,HB07776,Deluxe,King,2,Often shake visit think system own spring total.
HS07777,HB07777,Deluxe,King,3,Little at officer maintain effect.
HS07778,HB07778,Deluxe,Single,3,Poor often language.
HS07779,HB07779,Suite,King,4,Spend herself least.
HS07780,HB07780,Standard,King,1,Rule middle base wall race main would.
HS07781,HB07781,Standard,Double,2,Report call particularly player.
HS07782,HB07782,Suite,Double,1,Professional finally mouth current hold.
HS07783,HB07783,Standard,Single,1,With how evidence push customer summer.
HS07784,HB07784,Suite,Single,3,Treat focus hit arrive.
HS07785,HB07785,Deluxe,King,2,Take though tree such.
HS07786,HB07786,Deluxe,King,4,Former century while including born.
HS07787,HB07787,Deluxe,Single,5,Network administration nation.
HS07788,HB07788,Deluxe,Double,1,Let concern smile plan Democrat region lose season.
HS07789,HB07789,Deluxe,King,1,Large admit player base you light begin.
HS07790,HB07790,Standard,Single,5,Industry not focus paper agree identify woman.
HS07791,HB07791,Standard,Double,2,Whose knowledge official above south response especially.
HS07792,HB07792,Standard,Double,2,Actually scientist camera point vote.
HS07793,HB07793,Deluxe,Single,2,Hair color home hot example citizen force.
HS07794,HB07794,Standard,Single,4,Military about improve no wait adult.
HS07795,HB07795,Suite,Double,1,Together rather important.
HS07796,HB07796,Standard,Double,4,Budget miss structure.
HS07797,HB07797,Standard,Double,4,Glass night action eight.
HS07798,HB07798,Suite,Double,2,Low difficult morning adult identify understand.
HS07799,HB07799,Suite,King,5,Family morning forward great life.
HS07800,HB07800,Suite,Single,2,Loss week car behind which company treat analysis.
HS07801,HB07801,Deluxe,King,5,Chance practice money third million.
HS07802,HB07802,Suite,King,4,Course human nearly learn call protect few.
HS07803,HB07803,Suite,King,2,Language do most together point.
HS07804,HB07804,Standard,Single,1,East different paper wall month.
HS07805,HB07805,Standard,Double,4,Kid much moment fight want song general.
HS07806,HB07806,Suite,King,1,Scientist scene affect check research.
HS07807,HB07807,Suite,Single,2,Bed home establish exactly foot want.
HS07808,HB07808,Standard,Single,1,Environment Mrs wonder development establish.
HS07809,HB07809,Deluxe,Single,1,Light a blood.
HS07810,HB07810,Standard,King,2,Mouth must buy into in usually.
HS07811,HB07811,Deluxe,Double,4,Nature office expect fund shoulder.
HS07812,HB07812,Deluxe,Single,4,Check realize professional none arrive purpose bill.
HS07813,HB07813,Deluxe,Double,5,Coach over sing score quickly light.
HS07814,HB07814,Suite,Double,2,Serious process that treatment PM of radio.
HS07815,HB07815,Standard,Double,1,East especially I within hard.
HS07816,HB07816,Deluxe,Double,1,Yeah than suggest movement win.
HS07817,HB07817,Suite,Single,3,Yet wide age include bank our.
HS07818,HB07818,Standard,Single,5,Line child able measure someone when take.
HS07819,HB07819,Deluxe,Single,5,They concern say attack.
HS07820,HB07820,Standard,Double,5,Crime contain law feel develop.
HS07821,HB07821,Standard,King,2,Might wall party democratic particularly.
HS07822,HB07822,Suite,King,3,Plan family course move alone hospital another.
HS07823,HB07823,Standard,Double,4,Tend education beautiful.
HS07824,HB07824,Deluxe,Single,2,Rich whatever end.
HS07825,HB07825,Suite,Double,5,Real maybe value month especially must.
HS07826,HB07826,Suite,Double,4,American majority rest certain value human.
HS07827,HB07827,Deluxe,King,5,Book idea item lay.
HS07828,HB07828,Deluxe,King,4,Increase million head politics possible despite night.
HS07829,HB07829,Suite,Single,3,Time total prevent mission fact.
HS07830,HB07830,Deluxe,Double,4,Girl ground forget pull teacher note.
HS07831,HB07831,Suite,Double,1,Economy shoulder lead compare.
HS07832,HB07832,Standard,King,5,Into bring sing behavior.
HS07833,HB07833,Deluxe,Single,1,Memory door identify defense interesting.
HS07834,HB07834,Deluxe,Double,5,Only pay special event.
HS07835,HB07835,Standard,King,1,Night future wide reflect.
HS07836,HB07836,Suite,Single,1,Drop maybe page respond remain.
HS07837,HB07837,Deluxe,Single,3,Accept subject director thought figure seven adult number.
HS07838,HB07838,Standard,King,5,Best pass test rate nation believe hand.
HS07839,HB07839,Standard,King,4,Hand raise interview.
HS07840,HB07840,Deluxe,King,1,Include leg box close.
HS07841,HB07841,Deluxe,Single,1,Long side organization pick culture because.
HS07842,HB07842,Standard,Single,5,Hold science fast.
HS07843,HB07843,Deluxe,King,2,Truth score machine attorney left.
HS07844,HB07844,Suite,Double,1,South dark majority organization believe yeah.
HS07845,HB07845,Standard,Single,4,Third whom trade letter degree modern purpose.
HS07846,HB07846,Deluxe,Single,4,Magazine oil magazine wind note contain.
HS07847,HB07847,Standard,Double,1,Imagine every through seek music growth national.
HS07848,HB07848,Deluxe,King,1,City machine however special rock eight be.
HS07849,HB07849,Suite,King,2,Name over long without choose tough.
HS07850,HB07850,Suite,King,1,Hope in seem leg.
HS07851,HB07851,Suite,Double,2,Her sell concern either.
HS07852,HB07852,Standard,Double,4,Help for event TV agency.
HS07853,HB07853,Standard,Double,1,Worker hundred water security near.
HS07854,HB07854,Deluxe,Single,3,Thus tend color source perform meet.
HS07855,HB07855,Deluxe,King,1,Must expert offer hundred.
HS07856,HB07856,Suite,Double,3,Low teacher entire just.
HS07857,HB07857,Deluxe,King,5,Enjoy guy establish late nor somebody.
HS07858,HB07858,Standard,Double,4,Environmental put themselves party group.
HS07859,HB07859,Suite,Single,4,Rest camera home state notice nor there just.
HS07860,HB07860,Deluxe,Single,2,Establish cell American.
HS07861,HB07861,Deluxe,Single,1,Voice develop now game.
HS07862,HB07862,Suite,Single,1,War member bar they movement.
HS07863,HB07863,Standard,Double,5,Piece material represent car make other.
HS07864,HB07864,Deluxe,King,5,Include article blood win.
HS07865,HB07865,Deluxe,Double,1,Environmental throughout most today find.
HS07866,HB07866,Suite,Single,3,Least worry near represent.
HS07867,HB07867,Suite,Single,4,Above care rest lay off.
HS07868,HB07868,Suite,Single,2,Hit draw case age husband they.
HS07869,HB07869,Deluxe,King,1,Blue find large job whom.
HS07870,HB07870,Deluxe,Single,3,Cover special seek machine he short million.
HS07871,HB07871,Suite,King,5,Set city positive but.
HS07872,HB07872,Suite,Double,1,Trade child represent whatever degree happy owner.
HS07873,HB07873,Standard,King,4,Growth seven turn explain box.
HS07874,HB07874,Standard,Single,3,Language skill law whose decision most.
HS07875,HB07875,Deluxe,Single,2,Often show ball recognize threat choose wear conference.
HS07876,HB07876,Standard,Double,2,Leader table way professor commercial manage.
HS07877,HB07877,Standard,Single,4,Maintain build available parent human.
HS07878,HB07878,Suite,King,5,Price above suggest even institution movement hit.
HS07879,HB07879,Deluxe,Double,3,Traditional treatment beyond guess specific.
HS07880,HB07880,Suite,Single,4,Effect look check million.
HS07881,HB07881,Suite,King,3,Develop now figure sound strong.
HS07882,HB07882,Suite,Single,1,Season your lead bit.
HS07883,HB07883,Deluxe,Double,2,Strategy night reflect allow generation five.
HS07884,HB07884,Suite,Single,5,Inside religious billion thing even.
HS07885,HB07885,Deluxe,King,1,Me practice up everything.
HS07886,HB07886,Deluxe,Double,5,Early kid avoid center throw special team security.
HS07887,HB07887,Deluxe,Double,1,Leg member manage head also easy eat.
HS07888,HB07888,Suite,King,3,Gun sign necessary family never hope.
HS07889,HB07889,Deluxe,Single,1,Already parent fine.
HS07890,HB07890,Standard,King,2,Nature behavior team tend likely treat appear.
HS07891,HB07891,Deluxe,Single,1,Home evidence shake rise.
HS07892,HB07892,Standard,King,5,Sing goal PM nation.
HS07893,HB07893,Suite,King,3,Stop difficult deep work.
HS07894,HB07894,Deluxe,Double,5,Wide surface do bed day.
HS07895,HB07895,Deluxe,King,3,Stay large four ok himself seat.
HS07896,HB07896,Standard,King,3,Really father whose summer series under.
HS07897,HB07897,Standard,King,3,Camera grow stay for.
HS07898,HB07898,Deluxe,Double,5,Capital provide order everyone great later prepare.
HS07899,HB07899,Deluxe,Single,4,Learn go avoid minute since land.
HS07900,HB07900,Deluxe,King,3,Different company yard nature break energy gas group.
HS07901,HB07901,Suite,Single,2,Know prove sign against door.
HS07902,HB07902,Deluxe,Double,3,Service nothing attack study forward soldier wall.
HS07903,HB07903,Deluxe,Single,3,Sister thought good half if response fact.
HS07904,HB07904,Standard,Single,3,Indicate force entire second continue.
HS07905,HB07905,Suite,Double,5,Far system about although.
HS07906,HB07906,Standard,Double,4,Pattern leave minute respond dream approach total plan.
HS07907,HB07907,Standard,Double,1,Street hour available protect whether.
HS07908,HB07908,Suite,Double,5,Style modern term raise yeah operation forget.
HS07909,HB07909,Deluxe,King,1,Pm pressure common city child each phone detail.
HS07910,HB07910,Deluxe,Single,3,Animal need community hospital mouth traditional power accept.
HS07911,HB07911,Suite,King,4,Wish spend beyond feel election work.
HS07912,HB07912,Suite,Single,3,She commercial close media party.
HS07913,HB07913,Standard,Single,4,Close various order compare his public.
HS07914,HB07914,Deluxe,King,1,Tell apply skin look although.
HS07915,HB07915,Standard,Double,4,Against listen shake line might.
HS07916,HB07916,Standard,Single,3,Reveal hear throw whole.
HS07917,HB07917,Standard,Single,2,Huge have up without.
HS07918,HB07918,Suite,Double,2,Cell water north explain control class their.
HS07919,HB07919,Suite,King,5,Nearly respond prepare owner.
HS07920,HB07920,Suite,Single,2,Theory level magazine.
HS07921,HB07921,Suite,King,5,Safe couple line quite.
HS07922,HB07922,Standard,King,2,Sign task true task either may develop computer.
HS07923,HB07923,Standard,King,5,Far evidence television.
HS07924,HB07924,Standard,King,3,Figure energy think respond player well trouble.
HS07925,HB07925,Suite,King,2,Ten fund back feeling contain land.
HS07926,HB07926,Standard,Single,4,Clearly will stay voice.
HS07927,HB07927,Deluxe,King,5,Policy ready deal red.
HS07928,HB07928,Standard,Double,3,Kind world the.
HS07929,HB07929,Suite,Single,3,Clearly day sport argue organization.
HS07930,HB07930,Standard,Single,1,Sit art political discussion voice direction movement.
HS07931,HB07931,Suite,Single,3,Future economic campaign color.
HS07932,HB07932,Standard,King,1,Clearly voice month address federal wear even.
HS07933,HB07933,Suite,Single,2,Perhaps actually radio half just knowledge.
HS07934,HB07934,Deluxe,Single,2,Know happy fly particular marriage.
HS07935,HB07935,Deluxe,Double,2,Ahead join thousand my young.
HS07936,HB07936,Deluxe,King,5,And name seat.
HS07937,HB07937,Standard,Double,1,Loss body live above best.
HS07938,HB07938,Standard,King,2,Draw brother already share catch.
HS07939,HB07939,Suite,Single,1,Bag cultural concern on get relate last than.
HS07940,HB07940,Deluxe,Single,1,Result order senior world dinner.
HS07941,HB07941,Standard,Single,1,Business work future store.
HS07942,HB07942,Standard,Single,3,Site five above fast deal moment necessary.
HS07943,HB07943,Standard,King,5,Visit month none people improve.
HS07944,HB07944,Deluxe,Double,4,Likely number focus water stage think quite.
HS07945,HB07945,Suite,Double,5,Push I challenge morning.
HS07946,HB07946,Standard,Single,3,Also might something view of consumer.
HS07947,HB07947,Suite,Single,5,Fire painting image because.
HS07948,HB07948,Deluxe,King,3,Middle the energy leader economy.
HS07949,HB07949,Standard,Single,1,Message nature hit.
HS07950,HB07950,Suite,Single,4,Clearly since beat security.
HS07951,HB07951,Standard,Double,3,May fight arrive floor increase how.
HS07952,HB07952,Deluxe,Double,4,Adult instead change event seat play.
