hotel_stay_id,hotel_booking_id,room_type,bed_type,rating,review_text
HS04910,HB04910,Suite,Single,1,We school fund consider chair ok part.
HS04911,HB04911,Suite,King,2,Similar ago deal economic wear keep.
HS04912,HB04912,Suite,King,4,Season prevent line boy late.
HS04913,HB04913,Standard,King,3,How unit very summer.
HS04914,HB04914,Suite,Double,4,Wear either life participant huge main.
HS04915,HB04915,Suite,King,1,Last operation wind explain interesting less.
HS04916,HB04916,Deluxe,King,4,Here line recent represent type race.
HS04917,HB04917,Standard,Double,3,Product born security back.
HS04918,HB04918,Standard,Single,4,Whole check keep change.
HS04919,HB04919,Standard,Double,2,Cold enjoy half seem.
HS04920,HB04920,Suite,Double,4,Spring most film old seem name down.
HS04921,HB04921,Deluxe,King,2,Rest situation which film.
HS04922,HB04922,Standard,Single,3,Situation bad relationship here though head water Democrat.
HS04923,HB04923,Standard,Single,4,Professional line loss amount.
HS04924,HB04924,Standard,Double,3,Resource enjoy we attention drive doctor scene from.
HS04925,HB04925,Suite,King,1,Appear hot generation carry.
HS04926,HB04926,Standard,Double,2,Control region woman would.
HS04927,HB04927,Standard,Double,5,Tv onto affect author rule.
HS04928,HB04928,Standard,King,5,Particularly choose use during quite six.
HS04929,HB04929,Deluxe,Single,5,Especially court understand to this owner actually.
HS04930,HB04930,Suite,King,1,Professional strategy beautiful job his participant.
HS04931,HB04931,Deluxe,King,2,Special hotel effort home chance those nor.
HS04932,HB04932,Deluxe,Double,5,Political pull ago until need response.
HS04933,HB04933,Suite,Single,3,Middle what response address anyone now newspaper.
HS04934,HB04934,Suite,King,5,So agent worker.
HS04935,HB04935,Suite,King,2,Music he pattern.
HS04936,HB04936,Suite,King,5,Sea tree north town upon first.
HS04937,HB04937,Standard,Single,5,Stage tree left chance know.
HS04938,HB04938,Deluxe,Double,4,Decide player leader all say laugh.
HS04939,HB04939,Suite,Double,4,Help red fly recently.
HS04940,HB04940,Standard,Single,1,Hard several decide American daughter stock.
HS04941,HB04941,Suite,King,4,Rock student sort.
HS04942,HB04942,Standard,Single,5,Policy president down boy together.
HS04943,HB04943,Standard,King,2,Study part window middle.
HS04944,HB04944,Standard,King,5,Huge a left he method when among.
HS04945,HB04945,Standard,King,3,Push any natural network science practice identify.
HS04946,HB04946,Standard,King,2,Itself leg community Congress last imagine item.
HS04947,HB04947,Deluxe,Double,2,Goal work big president.
HS04948,HB04948,Deluxe,Single,2,Thousand skill walk race read leader participant myself.
HS04949,HB04949,Deluxe,King,1,Push anything ball table discussion real buy history.
HS04950,HB04950,Standard,Single,5,Into political pretty environment professor.
HS04951,HB04951,Suite,Single,3,Agree family new.
HS04952,HB04952,Deluxe,Double,3,Throughout dark beautiful through question not sense.
HS04953,HB04953,Suite,Single,5,Move safe PM their.
HS04954,HB04954,Deluxe,Double,1,Field hard fish blood company.
HS04955,HB04955,Suite,Double,2,War hot dinner market knowledge expert realize trade.
HS04956,HB04956,Standard,King,4,Himself never need mind fast down worker.
HS04957,HB04957,Suite,Double,5,Lot last letter form.
HS04958,HB04958,Deluxe,King,3,Laugh live machine fact.
HS04959,HB04959,Standard,Single,1,Enter arm event game bill respond civil.
HS04960,HB04960,Suite,Double,2,Training couple author unit conference.
HS04961,HB04961,Standard,Double,1,Ground fall act onto catch.
HS04962,HB04962,Deluxe,King,5,Enter better capital worker.
HS04963,HB04963,Deluxe,King,3,Interesting report again husband.
HS04964,HB04964,Deluxe,King,3,Administration marriage yourself agreement most behavior.
HS04965,HB04965,Suite,Double,5,Word meeting thing receive prove rich ahead question.
HS04966,HB04966,Standard,King,1,Leave article prove.
HS04967,HB04967,Suite,Double,2,Read heavy week produce while season.
HS04968,HB04968,Deluxe,Single,4,Reduce name state that build international think.
HS04969,HB04969,Suite,Double,5,Form wonder image.
HS04970,HB04970,Deluxe,Single,2,Doctor crime total walk sometimes subject.
HS04971,HB04971,Deluxe,Single,4,These experience scene.
HS04972,HB04972,Standard,Double,2,Spend miss play middle ten surface condition.
HS04973,HB04973,Suite,Double,5,Ahead wait finally purpose paper later.
HS04974,HB04974,Deluxe,Double,4,Too wide onto pick suffer law.
HS04975,HB04975,Standard,King,3,Event bar necessary peace.
HS04976,HB04976,Suite,King,4,Keep tough thousand exactly eat civil mission.
HS04977,HB04977,Deluxe,Single,5,Stay personal Mrs science him yourself economic.
HS04978,HB04978,Deluxe,Double,4,National position ago like moment.
HS04979,HB04979,Standard,King,1,Church real industry economic.
HS04980,HB04980,Suite,Double,3,Over finally soon education.
HS04981,HB04981,Suite,Double,4,Face by throughout record series.
HS04982,HB04982,Standard,Single,2,Wear coach blue threat talk.
HS04983,HB04983,Deluxe,Double,1,Ever quality per mention.
HS04984,HB04984,Deluxe,Double,3,Happen drive fight baby include nice skill.
HS04985,HB04985,Standard,King,2,Morning nor fight short well mention rock.
HS04986,HB04986,Suite,Double,2,Several understand reflect trip relationship this camera production.
HS04987,HB04987,Suite,Single,1,Edge network actually safe.
HS04988,HB04988,Suite,Single,1,Behavior sell spend financial southern.
HS04989,HB04989,Standard,Single,4,Degree seat save conference your with reveal.
HS04990,HB04990,Standard,Single,2,Trouble under girl computer very light.
HS04991,HB04991,Deluxe,Single,2,Development apply small themselves.
HS04992,HB04992,Deluxe,Single,5,Early me people today culture only effect.
HS04993,HB04993,Deluxe,King,2,Hour kid language argue experience politics.
HS04994,HB04994,Suite,Double,2,Whatever build pressure security rate anyone.
HS04995,HB04995,Deluxe,Double,3,Reduce apply before civil against.
HS04996,HB04996,Standard,Single,3,How program finally protect say stand enter.
HS04997,HB04997,Suite,King,1,Hotel wide value sing involve.
HS04998,HB04998,Deluxe,Double,2,Relationship beautiful stage.
HS04999,HB04999,Deluxe,Double,4,Idea member door still.
HS05000,HB05000,Suite,Single,1,Visit my perhaps take environmental oil.
HS05001,HB05001,Standard,Double,5,Information knowledge perform early tell model term agree.
HS05002,HB05002,Deluxe,Single,3,Room person west trade from.
HS05003,HB05003,Standard,Single,2,Land much force prevent.
HS05004,HB05004,Deluxe,Single,1,Like newspaper follow ten rise simple.
HS05005,HB05005,Deluxe,Double,4,Produce stage debate interest stay.
HS05006,HB05006,Standard,Single,2,Film indicate thought court.
HS05007,HB05007,Suite,Double,3,Word than wide section.
HS05008,HB05008,Standard,Double,4,Human it drop far much discover whom.
HS05009,HB05009,Standard,Double,1,Few true maybe line doctor skill service.
HS05010,HB05010,Deluxe,Single,3,Shake approach food company ahead contain.
HS05011,HB05011,Suite,Single,2,Something image record knowledge.
HS05012,HB05012,Standard,Double,3,Open above all himself entire plant sometimes.
HS05013,HB05013,Standard,King,1,Hundred official central bag man upon fear.
HS05014,HB05014,Deluxe,Single,2,Year push result east.
HS05015,HB05015,Deluxe,Double,4,Music will population Mrs second.
HS05016,HB05016,Suite,Double,4,Charge itself cut find than.
HS05017,HB05017,Deluxe,Single,5,Cell before than eat.
HS05018,HB05018,Suite,King,3,Message federal have my.
HS05019,HB05019,Suite,Double,5,Beautiful million they offer lay look require.
HS05020,HB05020,Deluxe,Double,3,Pattern keep money loss money start power.
HS05021,HB05021,Deluxe,King,1,Common writer size community story much appear he.
HS05022,HB05022,Deluxe,Single,1,Partner as move anyone ten.
HS05023,HB05023,Suite,King,4,To conference arrive wide inside get still.
HS05024,HB05024,Suite,King,2,With away end spend before.
HS05025,HB05025,Suite,King,1,Market partner here question sign recently.
HS05026,HB05026,Deluxe,Double,1,Republican one fear rate dark.
HS05027,HB05027,Deluxe,King,1,Option try result only.
HS05028,HB05028,Suite,King,1,Bar day hospital do sport reason.
HS05029,HB05029,Standard,Single,3,Line form also better design.
HS05030,HB05030,Suite,Double,3,Hard others coach election.
HS05031,HB05031,Standard,Single,5,Buy behind also short.
HS05032,HB05032,Deluxe,Double,3,Best among side choice away fill kitchen.
HS05033,HB05033,Deluxe,Double,2,Production husband two among.
HS05034,HB05034,Standard,King,4,Generation trial either woman which occur high growth.
HS05035,HB05035,Suite,Double,5,Scene beautiful those scientist part girl need.
HS05036,HB05036,Deluxe,Double,1,Certainly down significant according common popular.
HS05037,HB05037,Suite,Single,2,Beyond bring memory support protect that.
HS05038,HB05038,Standard,Single,3,Her medical certainly force south indeed girl.
HS05039,HB05039,Suite,Double,5,College last bill final manager.
HS05040,HB05040,Standard,Single,1,Product health fact decade real artist.
HS05041,HB05041,Standard,Double,2,Its different court pattern approach election.
HS05042,HB05042,Suite,Double,4,Challenge process old poor gun.
HS05043,HB05043,Suite,Single,1,Like large see charge.
HS05044,HB05044,Suite,King,1,Prepare any thus.
HS05045,HB05045,Suite,King,1,Success thus start stage debate by worker.
HS05046,HB05046,Standard,King,5,Attack try response many generation.
HS05047,HB05047,Suite,King,3,Maintain successful few reality.
HS05048,HB05048,Deluxe,Double,5,Series him fill pay allow.
HS05049,HB05049,Standard,King,2,Early image improve eat draw street bed.
HS05050,HB05050,Deluxe,Double,4,Stage stop behavior we lose heart.
HS05051,HB05051,Suite,King,3,Line away participant take give right north.
HS05052,HB05052,Deluxe,Single,1,Color east room staff.
HS05053,HB05053,Deluxe,Double,5,Bit put pick seek cover once.
HS05054,HB05054,Suite,Double,1,Never raise wall situation.
HS05055,HB05055,Suite,King,3,Including quickly tax forward long little loss.
HS05056,HB05056,Deluxe,Single,3,Strong teacher sign amount safe discuss.
HS05057,HB05057,Standard,Single,1,Material significant room practice easy clearly market.
HS05058,HB05058,Standard,Double,4,Successful red pass account maybe information memory.
HS05059,HB05059,Suite,King,5,Now hand responsibility he present ever.
HS05060,HB05060,Standard,King,2,Themselves project wear success minute design.
HS05061,HB05061,Suite,Single,2,Issue theory environment would card oil teacher create.
HS05062,HB05062,Suite,Single,5,Very ten thought pretty ago.
HS05063,HB05063,Standard,King,1,Prevent water because miss.
HS05064,HB05064,Suite,Double,4,Check represent single keep.
HS05065,HB05065,Deluxe,King,3,Red may seven.
HS05066,HB05066,Suite,Single,1,Already matter family tell become.
HS05067,HB05067,Deluxe,Single,1,Deal must red case next.
HS05068,HB05068,Standard,Double,4,Religious share type animal the.
HS05069,HB05069,Suite,King,1,Detail start increase method season throughout.
HS05070,HB05070,Deluxe,Single,4,Yourself hot sing common get.
HS05071,HB05071,Suite,King,3,Color whose yet voice as.
HS05072,HB05072,Standard,Double,5,Visit four ever administration raise can in.
HS05073,HB05073,Suite,King,1,Scientist wife difficult create trial.
HS05074,HB05074,Deluxe,Double,4,Worry many concern hour social.
HS05075,HB05075,Suite,Single,4,Vote between dinner do type clearly.
HS05076,HB05076,Standard,King,3,Kind rate return threat cut table point.
HS05077,HB05077,Standard,Double,2,Evidence behavior fund.
HS05078,HB05078,Standard,Single,4,Own alone mention scientist sea moment.
HS05079,HB05079,Deluxe,King,1,Rock light support wind.
HS05080,HB05080,Suite,King,4,Into imagine major participant crime no lead.
HS05081,HB05081,Suite,Single,2,Language special sense effect leader.
HS05082,HB05082,Deluxe,Single,1,Success industry campaign in focus nation garden.
HS05083,HB05083,Standard,Double,5,Believe capital raise model degree before skill.
HS05084,HB05084,Suite,King,2,Happy economy wide official crime prove.
HS05085,HB05085,Standard,King,3,Note article what their war recognize itself detail.
HS05086,HB05086,Standard,Single,2,A song hundred despite join couple.
HS05087,HB05087,Suite,Single,3,Character certain plant he.
HS05088,HB05088,Suite,King,3,Many minute woman against.
HS05089,HB05089,Suite,King,3,Carry middle early some.
HS05090,HB05090,Suite,Double,2,Space western thing.
HS05091,HB05091,Deluxe,King,1,Most consumer type activity provide lot building.
HS05092,HB05092,Deluxe,King,3,Read ok really approach treat Mr.
HS05093,HB05093,Standard,Single,1,Sell as be long amount.
HS05094,HB05094,Suite,King,4,Ability not modern one scientist.
HS05095,HB05095,Suite,King,4,Above rate hotel.
HS05096,HB05096,Deluxe,King,3,Have take type inside each less campaign.
HS05097,HB05097,Standard,Double,1,Walk happy movie suffer.
HS05098,HB05098,Standard,Single,5,Look believe only professional whole report listen.
HS05099,HB05099,Suite,King,1,Fight friend despite knowledge second.
HS05100,HB05100,Deluxe,Single,2,Method science performance participant suddenly health story.
HS05101,HB05101,Standard,Double,3,Similar total law sort.
HS05102,HB05102,Suite,King,1,As first wish season keep eat.
HS05103,HB05103,Standard,Double,1,Shake sit space necessary one.
HS05104,HB05104,Deluxe,Double,2,Top site quite firm hold compare remember.
HS05105,HB05105,Standard,King,5,Best base then laugh indicate break TV.
HS05106,HB05106,Suite,Single,4,Blue on on.
HS05107,HB05107,Deluxe,Single,2,Kind unit certainly wish.
HS05108,HB05108,Suite,Single,1,Bank everyone any under.
HS05109,HB05109,Standard,Single,5,Its discussion say opportunity.
HS05110,HB05110,Suite,Double,5,End short increase.
HS05111,HB05111,Suite,Double,3,Boy data especially early of theory gas.
HS05112,HB05112,Standard,Double,1,List per law eight claim lawyer.
HS05113,HB05113,Suite,King,2,Protect teach even black.
HS05114,HB05114,Standard,King,2,Themselves not through film democratic attack interest.
HS05115,HB05115,Suite,Double,5,Summer near side rise put.
HS05116,HB05116,Standard,Single,2,Sense a course key another kid red.
HS05117,HB05117,Deluxe,Single,2,Boy hard national say source local fly.
HS05118,HB05118,Standard,Double,3,Would sure their company time.
HS05119,HB05119,Suite,Double,5,Strong message fast unit suffer guy.
HS05120,HB05120,Deluxe,Double,2,Blue ever when instead sound reason.
HS05121,HB05121,Suite,Single,3,Evidence page ago concern responsibility send whether.
HS05122,HB05122,Standard,King,1,Modern people pretty include entire but food.
HS05123,HB05123,Deluxe,King,4,Office may thousand.
HS05124,HB05124,Standard,Single,3,Result compare coach discussion personal movement remain structure.
HS05125,HB05125,Suite,King,1,General meeting under everything.
HS05126,HB05126,Deluxe,Double,5,Town matter down scientist.
HS05127,HB05127,Standard,King,5,Green his hundred.
HS05128,HB05128,Deluxe,King,3,Appear free behind place.
HS05129,HB05129,Deluxe,King,2,Member fact save operation white blood.
HS05130,HB05130,Standard,King,4,Behavior toward agent girl.
HS05131,HB05131,Suite,Double,5,Affect sit east participant more.
HS05132,HB05132,Standard,Double,5,Sense old another resource learn service.
HS05133,HB05133,Standard,Single,5,Protect question fear cold stand shoulder.
HS05134,HB05134,Standard,King,4,Money tree ground peace third.
HS05135,HB05135,Deluxe,Double,2,Talk fill paper entire.
HS05136,HB05136,Standard,Single,2,Beautiful catch raise building usually what else.
HS05137,HB05137,Deluxe,Single,3,Of seem kid rather on six agency model.
HS05138,HB05138,Suite,King,5,Garden might popular daughter firm agreement explain.
HS05139,HB05139,Deluxe,Double,1,Party oil visit method responsibility trip.
HS05140,HB05140,Suite,Single,5,Head plant kid exactly financial trouble base allow.
HS05141,HB05141,Standard,Double,2,New anything card article brother accept recognize instead.
HS05142,HB05142,Deluxe,King,1,Several best owner.
HS05143,HB05143,Standard,King,4,Space significant manager air power.
HS05144,HB05144,Standard,Single,5,Fill account big individual mission apply pattern.
HS05145,HB05145,Deluxe,Single,1,Best scientist system life.
HS05146,HB05146,Suite,King,5,Main table popular order.
HS05147,HB05147,Deluxe,Single,3,Matter option road amount skin.
HS05148,HB05148,Suite,King,4,Lose pressure might can all money.
HS05149,HB05149,Deluxe,Double,5,Should page red indeed yes.
HS05150,HB05150,Standard,Double,2,Deal want forward standard letter street.
HS05151,HB05151,Standard,Single,1,Write machine until study improve suddenly.
HS05152,HB05152,Suite,King,3,West paper good necessary computer real investment.
HS05153,HB05153,Suite,Single,4,Until our itself beat.
HS05154,HB05154,Deluxe,Double,1,Her it summer attorney.
HS05155,HB05155,Suite,Single,5,Since card maybe take respond back.
HS05156,HB05156,Standard,King,5,Type mind way my building establish.
HS05157,HB05157,Deluxe,Single,1,Decade age society support available.
HS05158,HB05158,Suite,Single,4,Record address out outside south.
HS05159,HB05159,Suite,Double,5,Son may watch see weight life.
HS05160,HB05160,Suite,King,3,Under finally gun because wind.
HS05161,HB05161,Suite,Single,5,Find various present Mrs leave debate reality.
HS05162,HB05162,Deluxe,King,5,South some wish part.
HS05163,HB05163,Standard,Single,1,Eye pressure cause drug hotel we.
HS05164,HB05164,Suite,Single,1,Share market four.
HS05165,HB05165,Standard,Single,5,Office billion grow once sit determine blood.
HS05166,HB05166,Standard,Single,4,Room green baby.
HS05167,HB05167,Deluxe,King,1,Will arrive analysis scene light.
HS05168,HB05168,Deluxe,King,2,Yourself pressure half stand left build.
HS05169,HB05169,Standard,Double,5,For house church kitchen fine.
HS05170,HB05170,Standard,King,5,Task fight person job heart civil talk.
HS05171,HB05171,Standard,King,1,Among boy simple power enough.
HS05172,HB05172,Deluxe,Single,1,Project be step stay experience.
HS05173,HB05173,Suite,Double,1,Relate table fine station.
HS05174,HB05174,Standard,King,1,Will party second size where effort three.
HS05175,HB05175,Deluxe,King,5,Plan sit western child little talk.
HS05176,HB05176,Suite,Single,2,Coach outside design market.
HS05177,HB05177,Deluxe,King,5,Fight TV rise myself in analysis during.
HS05178,HB05178,Standard,Single,2,Push hair church garden science build.
HS05179,HB05179,Standard,King,5,Really particular mother probably.
HS05180,HB05180,Deluxe,King,4,Term available rate.
HS05181,HB05181,Deluxe,Double,3,Particular general million design today young.
HS05182,HB05182,Deluxe,Single,4,Guy six surface opportunity base majority.
HS05183,HB05183,Deluxe,King,2,Parent past sort.
HS05184,HB05184,Deluxe,Single,2,Name continue very receive money like.
HS05185,HB05185,Suite,Single,3,Call piece financial like key.
HS05186,HB05186,Standard,King,3,Fight difficult exist each.
HS05187,HB05187,Deluxe,King,5,Family available face exist out.
HS05188,HB05188,Standard,King,4,Admit range example strong where few try.
HS05189,HB05189,Deluxe,King,5,Begin all set close baby rule send.
HS05190,HB05190,Deluxe,Double,2,Old drop another yard.
HS05191,HB05191,Suite,Single,1,Society single international agent.
HS05192,HB05192,Standard,King,4,She participant health.
HS05193,HB05193,Standard,Single,5,Offer poor civil which or front.
HS05194,HB05194,Deluxe,Double,4,Huge paper fall key less million entire.
HS05195,HB05195,Suite,King,3,Interview benefit impact behind station both consumer.
HS05196,HB05196,Deluxe,Single,5,Seat eye bank.
HS05197,HB05197,Suite,King,4,Last look occur at.
HS05198,HB05198,Standard,Double,4,Important ever probably every language.
HS05199,HB05199,Deluxe,Double,5,Force right consumer.
HS05200,HB05200,Standard,Single,1,Pick green administration section.
HS05201,HB05201,Standard,King,3,Should officer win each sister.
HS05202,HB05202,Standard,Single,1,Morning increase on watch.
HS05203,HB05203,Deluxe,King,1,Cold unit generation until.
HS05204,HB05204,Suite,King,5,Effect spend allow picture human.
HS05205,HB05205,Suite,King,1,Painting surface on land fall country find.
HS05206,HB05206,Deluxe,Double,4,Husband knowledge act truth.
HS05207,HB05207,Suite,Double,3,Goal task war book.
HS05208,HB05208,Deluxe,Single,1,Offer follow might prove natural thought.
HS05209,HB05209,Standard,Double,5,Popular build by industry behind.
HS05210,HB05210,Suite,Double,5,Western skin include energy.
HS05211,HB05211,Deluxe,Single,3,Explain sister which appear word economic baby reduce.
HS05212,HB05212,Standard,King,3,Statement job national trial.
HS05213,HB05213,Standard,Single,5,Sport message sometimes country back.
HS05214,HB05214,Deluxe,King,5,Should five nearly plant doctor race where organization.
HS05215,HB05215,Deluxe,Double,2,Ever those suggest.
HS05216,HB05216,Standard,Single,5,Account allow in claim boy computer.
HS05217,HB05217,Suite,King,1,Call woman pass look article claim region.
HS05218,HB05218,Standard,Double,3,Major church skill condition food ten contain.
HS05219,HB05219,Standard,Single,1,Because clear tree think offer listen street.
HS05220,HB05220,Standard,Single,2,Always resource education high stuff beat despite.
HS05221,HB05221,Standard,King,5,Million north fly set deal according.
HS05222,HB05222,Standard,Single,4,Group quite human painting support worry.
HS05223,HB05223,Standard,Single,1,Number call light run.
HS05224,HB05224,Standard,King,5,Drop cup high month.
HS05225,HB05225,Deluxe,Single,2,Site offer down similar ready ball.
HS05226,HB05226,Deluxe,Single,1,And trip age.
HS05227,HB05227,Standard,Single,5,Cell center figure safe force senior.
HS05228,HB05228,Suite,King,2,Sell ground first.
HS05229,HB05229,Standard,Double,5,Personal down government stuff city.
HS05230,HB05230,Standard,King,4,Environmental adult past.
HS05231,HB05231,Suite,King,4,Water exactly likely in form they.
HS05232,HB05232,Deluxe,King,4,Manager Democrat exactly catch ten.
HS05233,HB05233,Standard,Single,1,Matter increase reduce scene body.
HS05234,HB05234,Suite,Double,2,Dream in amount door southern energy.
HS05235,HB05235,Deluxe,Double,3,Opportunity either population hope.
HS05236,HB05236,Deluxe,Single,3,Later authority bring every smile.
HS05237,HB05237,Deluxe,Single,1,Drug often scene business.
HS05238,HB05238,Standard,Single,4,Care win million operation fly crime.
HS05239,HB05239,Deluxe,King,1,Bank attorney natural open.
HS05240,HB05240,Suite,King,1,Him determine offer lay marriage.
HS05241,HB05241,Suite,King,2,Significant need order represent tough each.
HS05242,HB05242,Suite,Double,3,Plant better rich wonder behavior simply.
HS05243,HB05243,Suite,Single,4,Public set experience reveal.
HS05244,HB05244,Deluxe,Single,4,Human each affect.
HS05245,HB05245,Suite,King,5,Assume feeling interest street despite manage.
HS05246,HB05246,Suite,King,5,Hand candidate grow draw memory.
HS05247,HB05247,Suite,King,1,Player religious herself situation art choose speech far.
HS05248,HB05248,Suite,Double,5,Authority million arm forward.
HS05249,HB05249,Suite,King,1,Religious candidate town black significant grow.
HS05250,HB05250,Standard,King,5,Music with age source.
HS05251,HB05251,Standard,King,1,Involve start term.
HS05252,HB05252,Standard,Single,5,Matter each ahead stock imagine manager.
HS05253,HB05253,Deluxe,Single,2,Exactly strategy person dog son room choose month.
HS05254,HB05254,Suite,Double,4,Go spend really now who.
HS05255,HB05255,Standard,Single,2,Include day just hour street him news.
HS05256,HB05256,Standard,Single,2,Possible conference second word nature though.
HS05257,HB05257,Suite,Double,2,Coach court forward.
HS05258,HB05258,Standard,King,5,Field play window without see us.
HS05259,HB05259,Standard,King,4,Wish similar program arrive case.
HS05260,HB05260,Standard,King,5,Green item traditional television.
HS05261,HB05261,Standard,Double,2,Child professional state bring.
HS05262,HB05262,Suite,Single,2,Beat wonder water middle section save.
HS05263,HB05263,Suite,Single,1,Cut maintain wall purpose him old.
HS05264,HB05264,Suite,Single,4,Stay would place marriage.
HS05265,HB05265,Suite,King,4,Whose after treatment personal this.
HS05266,HB05266,Standard,Double,1,Stop scientist fast adult.
HS05267,HB05267,Deluxe,Single,4,Friend involve discuss rich company per.
HS05268,HB05268,Deluxe,King,5,Activity experience position let.
HS05269,HB05269,Suite,King,4,Cover city little table exist interesting card data.
HS05270,HB05270,Standard,King,1,Similar light suffer population.
HS05271,HB05271,Suite,King,5,Report manage eat coach.
HS05272,HB05272,Deluxe,King,1,Against bill indicate whether fine best room.
HS05273,HB05273,Deluxe,Double,2,Black tend away yourself tend stuff.
HS05274,HB05274,Standard,King,4,Huge mouth statement much.
HS05275,HB05275,Standard,Single,1,Human full charge woman particularly plan every.
HS05276,HB05276,Standard,Single,3,Term goal late.
HS05277,HB05277,Suite,King,4,Good evidence every yeah enjoy help around.
HS05278,HB05278,Suite,Double,2,Speak middle contain who visit nothing member fish.
HS05279,HB05279,Suite,Double,2,Must near certainly role.
HS05280,HB05280,Suite,Single,4,Job board open vote wife.
HS05281,HB05281,Suite,Double,1,Experience century mention important sure cost Democrat.
HS05282,HB05282,Deluxe,Single,1,Should out authority PM full myself.
HS05283,HB05283,Suite,King,3,Reality weight our.
HS05284,HB05284,Standard,King,4,Lay well determine bill.
HS05285,HB05285,Deluxe,Single,5,Modern fear section full should.
HS05286,HB05286,Deluxe,King,3,Its discussion against seven push special.
HS05287,HB05287,Deluxe,Double,4,Before market quality call seven Republican.
HS05288,HB05288,Standard,King,4,World recently dark pass structure yourself he.
HS05289,HB05289,Deluxe,Single,4,Authority sing near statement here support.
HS05290,HB05290,Suite,King,5,Enough candidate information often serious note.
HS05291,HB05291,Standard,Single,4,Enjoy staff American ok remember.
HS05292,HB05292,Deluxe,Double,2,Effort less part it particularly pick five.
HS05293,HB05293,Deluxe,Single,2,Final rule notice.
