hotel_stay_id,hotel_booking_id,room_type,bed_type,rating,review_text
HS00001,HB00001,Suite,Single,1,Begin boy feel cup.
HS00002,HB00002,Deluxe,Single,2,Stuff resource career he answer suddenly cell.
HS00003,HB00003,Deluxe,King,3,Everybody social camera control.
HS00004,HB00004,Standard,King,2,While stay attorney model employee despite.
HS00005,HB00005,Deluxe,Double,5,Exactly arm attention relate design relationship.
HS00006,HB00006,Deluxe,Double,1,Near human be truth.
HS00007,HB00007,Standard,Double,5,Should career enter protect cover increase enjoy.
HS00008,HB00008,Deluxe,Single,1,Ever performance professional more cover.
HS00009,HB00009,Standard,Single,4,Shake scene majority teach.
HS00010,HB00010,Suite,Single,2,About decision pressure wonder environment company eye.
HS00011,HB00011,Suite,Double,3,Piece high police magazine thank.
HS00012,HB00012,Deluxe,Single,2,Shake think water first scientist establish however.
HS00013,HB00013,Deluxe,Double,1,Respond us Democrat much myself tax wife affect.
HS00014,HB00014,Deluxe,Single,4,Word cell crime write him anyone finally.
HS00015,HB00015,Suite,Double,1,Trade bed list perform.
HS00016,HB00016,Suite,Double,4,Size she yard wrong citizen thank end.
HS00017,HB00017,Deluxe,Double,5,Mr case save focus thing.
HS00018,HB00018,Standard,Single,3,Statement woman growth never know success.
HS00019,HB00019,Suite,King,4,Town sure war.
HS00020,HB00020,Suite,King,1,Much story response someone.
HS00021,HB00021,Standard,Double,5,Other pull owner consumer Republican performance peace that.
HS00022,HB00022,Deluxe,Single,3,Thousand appear lawyer everyone experience red attorney.
HS00023,HB00023,Deluxe,King,5,Area production individual oil machine return south.
HS00024,HB00024,Standard,Double,5,Play billion leader tonight inside reflect alone.
HS00025,HB00025,Standard,King,5,Physical throughout analysis risk.
HS00026,HB00026,Deluxe,King,2,Of enjoy country cut couple.
HS00027,HB00027,Standard,Single,3,Increase knowledge forward peace newspaper drop reveal.
HS00028,HB00028,Deluxe,Double,2,Federal though how role degree cup head want.
HS00029,HB00029,Deluxe,Double,1,Only training that market evening quality deep view.
HS00030,HB00030,Standard,Double,5,Star central discover treat.
HS00031,HB00031,Deluxe,Double,3,Mr the federal the rise.
HS00032,HB00032,Standard,Single,1,Dinner fly rule record.
HS00033,HB00033,Standard,King,5,Design little everyone choice beautiful.
HS00034,HB00034,Standard,Single,4,Skill message mouth.
HS00035,HB00035,Deluxe,King,2,Place movie raise PM within throw.
HS00036,HB00036,Deluxe,King,2,Degree camera situation certain head difference difference.
HS00037,HB00037,Deluxe,Double,4,Hold begin follow sense.
HS00038,HB00038,Suite,Double,2,Spend green goal life.
HS00039,HB00039,Suite,Single,4,Stuff college western.
HS00040,HB00040,Deluxe,Double,3,Lose free strong art market ahead.
HS00041,HB00041,Deluxe,Single,5,Majority group sometimes summer prove performance.
HS00042,HB00042,Suite,King,5,Also organization campaign.
HS00043,HB00043,Deluxe,Double,1,Various police personal image.
HS00044,HB00044,Suite,Double,3,Focus theory ability color.
HS00045,HB00045,Standard,Double,4,Owner per data baby magazine high language.
HS00046,HB00046,Deluxe,Double,3,Point produce public free.
HS00047,HB00047,Deluxe,Double,5,Third new quite friend great million seven quite.
HS00048,HB00048,Deluxe,Double,3,Through road music picture.
HS00049,HB00049,Deluxe,King,3,Rock girl for style learn image.
HS00050,HB00050,Deluxe,Single,3,Hit its long perform.
HS00051,HB00051,Deluxe,Single,5,Matter audience site already guy thank affect.
HS00052,HB00052,Suite,Double,2,Town language fly professor.
HS00053,HB00053,Standard,Double,3,Deal girl single then guess production common.
HS00054,HB00054,Deluxe,Double,4,Order quickly throw garden.
HS00055,HB00055,Deluxe,Single,1,Feeling blue common type.
HS00056,HB00056,Suite,Single,4,Laugh never TV voice.
HS00057,HB00057,Suite,King,1,Former tell current movement thus half world.
HS00058,HB00058,Suite,Single,4,Hope often right which need.
HS00059,HB00059,Suite,King,1,Son start go peace relate unit.
HS00060,HB00060,Deluxe,King,2,Between east evidence our.
HS00061,HB00061,Standard,Single,2,House teach generation.
HS00062,HB00062,Standard,King,1,Least tree help raise style.
HS00063,HB00063,Deluxe,Double,5,Everything from early teacher term ground only property.
HS00064,HB00064,Suite,King,5,Who phone seven within event.
HS00065,HB00065,Deluxe,Double,1,Choose benefit again without tough suddenly.
HS00066,HB00066,Standard,Double,3,College nearly year act safe forget however.
HS00067,HB00067,Deluxe,King,2,Movement town never base.
HS00068,HB00068,Suite,Single,3,Drug debate real side century.
HS00069,HB00069,Standard,Double,1,Detail create character different.
HS00070,HB00070,Standard,King,1,Red close accept president travel.
HS00071,HB00071,Deluxe,Single,4,Early class good especially use power.
HS00072,HB00072,Suite,Double,2,Beautiful night operation director.
HS00073,HB00073,Standard,Double,3,Instead boy team art guess.
HS00074,HB00074,Suite,Double,1,Door shake state feeling us.
HS00075,HB00075,Standard,Single,5,Father best laugh rather make gas.
HS00076,HB00076,Suite,Single,4,Ability professor realize campaign.
HS00077,HB00077,Suite,Double,5,Somebody happy public play thus network toward.
HS00078,HB00078,Deluxe,Single,3,Story college staff capital per develop old.
HS00079,HB00079,Standard,Double,1,Anyone threat blood course actually.
HS00080,HB00080,Deluxe,Single,2,International again paper maintain car.
HS00081,HB00081,Deluxe,King,2,Lot also apply environmental never theory right.
HS00082,HB00082,Deluxe,Single,5,Land later example though.
HS00083,HB00083,Suite,Single,3,Also head white determine stay several ability.
HS00084,HB00084,Suite,Double,2,Edge option improve research by us network usually.
HS00085,HB00085,Standard,Double,3,Individual player continue else word animal.
HS00086,HB00086,Standard,King,1,Certain off glass pass occur land above term.
HS00087,HB00087,Standard,Single,1,Least traditional development fund.
HS00088,HB00088,Suite,Single,3,Support offer little issue analysis police.
HS00089,HB00089,Deluxe,King,2,Claim but prevent final present hard.
HS00090,HB00090,Standard,Single,3,Sport impact whether.
HS00091,HB00091,Standard,Double,5,Bit option response wide require offer.
HS00092,HB00092,Deluxe,Double,1,Treatment value theory conference mouth realize campaign.
HS00093,HB00093,Standard,Double,2,Upon degree industry point.
HS00094,HB00094,Standard,Single,5,Move help million set sport.
HS00095,HB00095,Deluxe,King,4,Involve wife manage lawyer.
HS00096,HB00096,Deluxe,Single,2,Its require network activity room.
HS00097,HB00097,Deluxe,King,3,Enter radio expect Congress lose alone.
HS00098,HB00098,Suite,King,1,Increase special behavior really assume approach.
HS00099,HB00099,Standard,Double,5,Spend go security standard state.
HS00100,HB00100,Deluxe,King,2,Report exist level.
HS00101,HB00101,Suite,Double,1,Why certain decision.
HS00102,HB00102,Suite,Single,4,Industry race red performance boy service sea.
HS00103,HB00103,Suite,Single,4,What do minute level onto anything.
HS00104,HB00104,Deluxe,Single,5,Else look car.
HS00105,HB00105,Deluxe,Single,4,Produce them fire option.
HS00106,HB00106,Standard,King,2,Popular level light represent.
HS00107,HB00107,Standard,Double,4,World dream I.
HS00108,HB00108,Standard,Double,3,Mr his what only wear might turn.
HS00109,HB00109,Standard,King,4,Bar nice book allow every.
HS00110,HB00110,Deluxe,King,4,Think part woman gas.
HS00111,HB00111,Standard,Double,2,Stage something effort water reality fall.
HS00112,HB00112,Suite,Double,3,Later the clear guess shake ground.
HS00113,HB00113,Standard,Double,1,Any simply short new voice state.
HS00114,HB00114,Suite,Double,2,Officer spring audience that west simple spend.
HS00115,HB00115,Suite,Double,5,Reflect consider brother physical particularly must from.
HS00116,HB00116,Standard,Single,5,Option where particular natural or environmental.
HS00117,HB00117,Deluxe,Double,4,Rate audience Mrs prevent Republican crime.
HS00118,HB00118,Standard,Double,4,Front who cut raise.
HS00119,HB00119,Standard,Double,3,Huge contain night part beat or produce.
HS00120,HB00120,Deluxe,Single,4,Position although six these major easy.
HS00121,HB00121,Standard,Single,5,Ball order certain letter herself environment of.
HS00122,HB00122,Standard,Double,2,Course place suddenly alone future hard expect believe.
HS00123,HB00123,Standard,Single,1,Sister final sing cell.
HS00124,HB00124,Deluxe,King,2,Soon eye minute interesting happy easy.
HS00125,HB00125,Suite,King,1,Method who reduce question possible west worker should.
HS00126,HB00126,Deluxe,Double,2,Use bar industry.
HS00127,HB00127,Standard,Single,3,Situation cause develop.
HS00128,HB00128,Standard,Double,2,Choose fight second.
HS00129,HB00129,Suite,Single,3,Travel world southern get staff.
HS00130,HB00130,Deluxe,Double,5,Crime establish question attorney key.
HS00131,HB00131,Suite,King,5,Family wear order fast goal brother.
HS00132,HB00132,Suite,Single,1,Treat force than who have.
HS00133,HB00133,Deluxe,King,5,Human identify road data miss late service.
HS00134,HB00134,Standard,Double,3,Me chance including research pressure policy.
HS00135,HB00135,Suite,Single,1,Continue up factor choose.
HS00136,HB00136,Suite,King,5,Perform degree mention baby.
HS00137,HB00137,Suite,King,1,Operation letter whether cell.
HS00138,HB00138,Suite,Single,3,Agency guess traditional especially.
HS00139,HB00139,Deluxe,King,4,Chair policy area various bill enter.
HS00140,HB00140,Deluxe,Single,2,Least ability result.
HS00141,HB00141,Suite,Single,4,Nation several authority off suddenly second court.
HS00142,HB00142,Deluxe,Single,3,Throw stage born pull onto.
HS00143,HB00143,Standard,King,1,Role open section my.
HS00144,HB00144,Deluxe,Double,4,Pressure capital however clearly nice.
HS00145,HB00145,Deluxe,Single,1,Executive ball final manager authority.
HS00146,HB00146,Suite,Single,5,Director reality staff throughout cell on example.
HS00147,HB00147,Suite,King,1,Follow eye establish American employee.
HS00148,HB00148,Deluxe,Double,2,Nothing clearly young mean we field safe.
HS00149,HB00149,Deluxe,King,3,Matter environment region.
HS00150,HB00150,Standard,King,5,Set staff important three simply future.
HS00151,HB00151,Standard,Double,5,Laugh space system window eight show.
HS00152,HB00152,Deluxe,Single,1,Describe state court low seem TV artist.
HS00153,HB00153,Deluxe,Double,4,Early team growth education certain too.
HS00154,HB00154,Suite,King,1,House food few resource seat better.
HS00155,HB00155,Standard,Double,2,Pull west wrong participant change writer end unit.
HS00156,HB00156,Deluxe,Double,1,Financial southern player involve.
HS00157,HB00157,Suite,King,1,Five rise throughout state during memory ask.
HS00158,HB00158,Deluxe,Single,2,Book how five century study rather interesting.
HS00159,HB00159,Deluxe,King,3,Focus magazine cut film crime program election.
HS00160,HB00160,Deluxe,Single,4,Before notice property detail.
HS00161,HB00161,Deluxe,Single,3,Many near yet customer network strategy.
HS00162,HB00162,Suite,King,1,Fish source offer approach.
HS00163,HB00163,Deluxe,Single,2,Know such natural.
HS00164,HB00164,Standard,Single,3,Phone yard nearly instead evidence heavy begin.
HS00165,HB00165,Suite,Double,4,Gun might country way mother.
HS00166,HB00166,Standard,King,4,Say into before speech cell.
HS00167,HB00167,Suite,King,1,Treat during despite protect offer wait.
HS00168,HB00168,Suite,Double,5,Task it maintain modern decision finish generation.
HS00169,HB00169,Suite,Single,5,Organization news week.
HS00170,HB00170,Deluxe,Double,5,Like body effect radio child.
HS00171,HB00171,Standard,Single,4,Executive know life spend production physical success enough.
HS00172,HB00172,Suite,Single,1,Situation soldier low guy.
HS00173,HB00173,Standard,King,4,Politics assume resource professional down.
HS00174,HB00174,Suite,Double,5,Fill station site hair beautiful.
HS00175,HB00175,Suite,Double,4,Clear door agree far.
HS00176,HB00176,Deluxe,Double,5,Wall wish hair other put unit.
HS00177,HB00177,Suite,King,2,Newspaper degree spend cost reality fish.
HS00178,HB00178,Deluxe,Single,2,Kitchen ready often anyone street produce quite laugh.
HS00179,HB00179,Deluxe,Double,3,Daughter effect tonight wind five great help.
HS00180,HB00180,Standard,King,3,Usually city money measure suggest foot painting.
HS00181,HB00181,Suite,Double,1,Them full painting rest second information.
HS00182,HB00182,Deluxe,King,3,Democrat outside area not between paper debate.
HS00183,HB00183,Deluxe,King,5,Green film him approach under phone animal service.
HS00184,HB00184,Suite,King,1,Far early half art billion.
HS00185,HB00185,Deluxe,Single,2,Agreement computer create market a.
HS00186,HB00186,Deluxe,Single,1,Certainly name suddenly address suffer.
HS00187,HB00187,Suite,Single,5,Water seem read change make reality.
HS00188,HB00188,Deluxe,King,2,Marriage represent positive interview real event table.
HS00189,HB00189,Suite,Single,1,Painting include American total.
HS00190,HB00190,Suite,King,1,Show open toward style street.
HS00191,HB00191,Deluxe,King,4,Power themselves catch western term model.
HS00192,HB00192,Standard,Single,5,Maybe attention child figure crime look.
HS00193,HB00193,Suite,Double,2,Strategy data effort.
HS00194,HB00194,Standard,Single,1,Leave particular able wait.
HS00195,HB00195,Deluxe,Single,5,Travel seem party.
HS00196,HB00196,Deluxe,King,2,All catch world four marriage there.
HS00197,HB00197,Deluxe,Single,4,Here Mr know American add call.
HS00198,HB00198,Deluxe,King,5,Realize again cover myself no finally will.
HS00199,HB00199,Standard,Single,3,Whose house military doctor trip ground.
HS00200,HB00200,Standard,Single,5,Positive find president.
HS00201,HB00201,Suite,Double,5,Week plan if lead against couple simple.
HS00202,HB00202,Suite,Double,4,Government nor interview.
HS00203,HB00203,Standard,Single,2,College man law professor every.
HS00204,HB00204,Suite,Single,1,Talk apply build production line together parent.
HS00205,HB00205,Standard,Single,3,Tv simple ability time result lose your.
HS00206,HB00206,Standard,Double,5,Six energy talk face.
HS00207,HB00207,Suite,King,2,Reach old change beautiful visit treat.
HS00208,HB00208,Suite,King,4,Six should follow well painting someone mother.
HS00209,HB00209,Standard,Single,3,Conference within organization business country.
HS00210,HB00210,Deluxe,Double,4,Possible single husband he.
HS00211,HB00211,Deluxe,Single,3,Share table money outside.
HS00212,HB00212,Deluxe,Single,5,Nice away reduce technology weight pattern.
HS00213,HB00213,Standard,King,4,He million man but sit.
HS00214,HB00214,Suite,King,3,Make necessary spring.
HS00215,HB00215,Suite,King,5,Good team role use appear.
HS00216,HB00216,Standard,King,3,Again hold hair world act huge.
HS00217,HB00217,Standard,Double,4,Newspaper young I behind wear about husband.
HS00218,HB00218,Standard,Single,4,Although and size fish write computer.
HS00219,HB00219,Deluxe,Single,3,Health foreign list almost brother eight.
HS00220,HB00220,Standard,King,4,War suddenly black.
HS00221,HB00221,Standard,Double,2,Same stage project Republican dinner.
HS00222,HB00222,Deluxe,Double,5,Like pretty account culture.
HS00223,HB00223,Standard,King,5,Listen billion arm your account.
HS00224,HB00224,Standard,Double,2,Mean PM somebody their.
HS00225,HB00225,Deluxe,Single,1,Well ability on PM expert station kind have.
HS00226,HB00226,Deluxe,Single,3,Far wear bank organization ball.
HS00227,HB00227,Deluxe,King,1,Amount head life century education public.
HS00228,HB00228,Standard,Double,1,Film describe material home sell cell.
HS00229,HB00229,Suite,King,3,Enjoy chance husband front.
HS00230,HB00230,Deluxe,Single,3,Phone fact consumer why career carry.
HS00231,HB00231,Suite,Double,4,During draw you.
HS00232,HB00232,Suite,King,1,History before still western.
HS00233,HB00233,Deluxe,Double,5,Language program use left feeling.
HS00234,HB00234,Deluxe,Single,5,Throughout amount travel ability test church piece travel.
HS00235,HB00235,Deluxe,Single,2,Environment interesting reality admit sit site benefit.
HS00236,HB00236,Standard,Single,1,Them poor scientist throw place time.
HS00237,HB00237,Deluxe,King,4,Sound democratic wish decade card though.
HS00238,HB00238,Deluxe,Double,1,Board result bag ground.
HS00239,HB00239,Suite,Double,3,Recently dream despite kitchen.
HS00240,HB00240,Suite,Single,2,Risk reveal per current.
HS00241,HB00241,Standard,King,5,Provide discuss TV same baby.
HS00242,HB00242,Suite,Single,5,Factor shoulder garden task.
HS00243,HB00243,Standard,Single,2,Never ago probably ground.
HS00244,HB00244,Suite,King,3,Decision seem control risk.
HS00245,HB00245,Standard,Single,1,Country expect model design.
HS00246,HB00246,Standard,Single,5,Let avoid character organization day film.
HS00247,HB00247,Suite,King,4,Nothing feeling it population.
HS00248,HB00248,Deluxe,Single,2,Lay in degree much describe rate hear.
HS00249,HB00249,Deluxe,Single,5,Total throughout church husband security suffer point.
HS00250,HB00250,Deluxe,Single,5,Bag big travel picture require education simple.
HS00251,HB00251,Standard,King,1,Story message believe before participant change.
HS00252,HB00252,Suite,King,5,Important movie fish bit.
HS00253,HB00253,Deluxe,King,3,Whole entire trouble century sign.
HS00254,HB00254,Standard,Single,2,Yard our soldier think meet plant.
HS00255,HB00255,Deluxe,Single,3,New expert measure.
HS00256,HB00256,Suite,Single,2,Sit story continue meeting operation.
HS00257,HB00257,Deluxe,Double,2,Travel five same coach behavior quickly anything protect.
HS00258,HB00258,Standard,Double,4,Physical take different option maybe give.
HS00259,HB00259,Suite,Double,3,Opportunity support exist hundred bank cut cold.
HS00260,HB00260,Standard,Double,3,Second remember worry people remain together commercial.
HS00261,HB00261,Deluxe,Single,4,Foot whose will.
HS00262,HB00262,Deluxe,Double,4,Show wrong act.
HS00263,HB00263,Suite,Single,4,Involve work building particular main.
HS00264,HB00264,Suite,King,4,Weight road evening blood.
HS00265,HB00265,Standard,Single,3,Too human remember language show.
HS00266,HB00266,Standard,Double,3,Growth plant authority public establish here affect.
HS00267,HB00267,Standard,Single,1,Enter address understand maintain.
HS00268,HB00268,Standard,King,4,Whom election respond country traditional tree serious line.
HS00269,HB00269,Standard,Double,3,Base collection sing significant.
HS00270,HB00270,Suite,King,2,Include person group.
HS00271,HB00271,Suite,King,3,Add inside pressure price buy.
HS00272,HB00272,Standard,Double,5,Magazine within author body beyond summer.
HS00273,HB00273,Deluxe,King,1,List tell administration best near news important.
HS00274,HB00274,Standard,Single,3,Beat feel quickly close same.
HS00275,HB00275,Deluxe,Double,4,Customer return turn although direction parent.
HS00276,HB00276,Deluxe,King,2,Peace strong everyone deal throw later our.
HS00277,HB00277,Standard,Double,5,Public today throw event positive.
HS00278,HB00278,Standard,King,3,Yeah economic left good side nor type.
HS00279,HB00279,Standard,Single,1,Media picture benefit half outside fear officer exist.
HS00280,HB00280,Suite,Single,2,Away product interest begin then past.
HS00281,HB00281,Suite,Double,4,Finish everybody assume fear physical.
HS00282,HB00282,Suite,Single,1,Vote feel to water yet off condition again.
HS00283,HB00283,Deluxe,King,4,Rest down laugh technology education.
HS00284,HB00284,Standard,Single,2,Would your realize.
HS00285,HB00285,Suite,King,2,Measure still ability protect.
HS00286,HB00286,Deluxe,King,5,Shake develop leave determine long far window.
HS00287,HB00287,Standard,Single,3,Candidate kind so.
HS00288,HB00288,Deluxe,Single,4,Political seat talk accept community crime.
HS00289,HB00289,Standard,Single,2,Across number with risk raise she for.
HS00290,HB00290,Standard,Double,3,Time benefit owner free it specific happen.
HS00291,HB00291,Standard,Double,4,Property hit better heavy either.
HS00292,HB00292,Deluxe,Single,2,Politics voice large amount daughter.
HS00293,HB00293,Deluxe,Single,4,Start cold if new off box.
HS00294,HB00294,Deluxe,Double,5,Whole billion act yard.
HS00295,HB00295,Deluxe,Double,4,Evidence stock save perform.
HS00296,HB00296,Standard,Double,1,Race medical chair large.
HS00297,HB00297,Suite,Single,3,Seat paper threat whether add coach entire.
HS00298,HB00298,Deluxe,King,2,Responsibility save usually behavior really.
HS00299,HB00299,Standard,King,4,Safe pull three majority several show.
HS00300,HB00300,Deluxe,Double,1,Natural usually anything state.
HS00301,HB00301,Suite,Double,5,Amount community east myself reduce would fall.
HS00302,HB00302,Suite,Single,2,Heavy the detail carry ability.
HS00303,HB00303,Deluxe,Single,2,Difference whose nothing memory.
HS00304,HB00304,Standard,Single,3,Lose be energy turn.
HS00305,HB00305,Deluxe,King,2,Have speech major ground popular though since.
HS00306,HB00306,Suite,King,1,Case professional if hour sometimes job.
HS00307,HB00307,Suite,Single,1,Support pull process mission.
HS00308,HB00308,Standard,Double,1,Light occur interesting compare activity wish must.
HS00309,HB00309,Deluxe,Single,5,Pay paper culture reveal trade very reason.
HS00310,HB00310,Deluxe,Double,2,Easy our more cut watch kid.
HS00311,HB00311,Deluxe,Single,2,Name kitchen work tree answer impact that front.
HS00312,HB00312,Suite,Single,1,Yes authority require wonder night develop pay because.
HS00313,HB00313,Standard,King,3,Economy while ball many professor throughout.
HS00314,HB00314,Suite,Single,1,Such game home military.
HS00315,HB00315,Suite,Single,1,Half stand wall last throughout later.
HS00316,HB00316,Standard,Double,1,None yard both actually fall course.
HS00317,HB00317,Suite,Single,1,Ball travel night near practice discussion choose.
HS00318,HB00318,Suite,King,5,Accept prove around different friend stay.
HS00319,HB00319,Deluxe,Single,1,Agreement step admit article.
HS00320,HB00320,Standard,Double,4,Know alone decade.
HS00321,HB00321,Standard,Single,3,Argue star stop animal world yeah begin quite.
HS00322,HB00322,Deluxe,Single,5,Camera yard few organization feeling people.
HS00323,HB00323,Deluxe,King,5,Entire gas board outside.
HS00324,HB00324,Standard,Double,1,Itself dark claim her test table increase.
HS00325,HB00325,Suite,Single,5,Rich amount every fight probably.
HS00326,HB00326,Standard,King,5,Idea wait vote note thus.
HS00327,HB00327,Deluxe,King,2,Look event head so the.
HS00328,HB00328,Deluxe,Single,4,Finally fight ball identify magazine radio exactly.
HS00329,HB00329,Standard,Double,4,Doctor sign art north.
HS00330,HB00330,Suite,Single,5,Nation since yet.
HS00331,HB00331,Suite,Double,2,Capital pass hundred firm term report hold.
HS00332,HB00332,Suite,Single,4,Eye TV state fast firm challenge.
HS00333,HB00333,Deluxe,King,3,Arm feeling fast better.
HS00334,HB00334,Standard,Single,3,Explain offer national yeah.
HS00335,HB00335,Deluxe,Single,4,Admit growth tax difficult.
HS00336,HB00336,Standard,King,2,Hard the month bring bar another.
HS00337,HB00337,Standard,Single,3,Address chance husband attorney week.
HS00338,HB00338,Standard,King,3,Think least serve true wall by.
HS00339,HB00339,Deluxe,Single,5,Push argue speech hundred.
HS00340,HB00340,Suite,Single,5,Read audience next expect not television sure.
HS00341,HB00341,Deluxe,Single,3,Mind by than kitchen side current similar.
HS00342,HB00342,Standard,King,1,Beyond old fact first.
HS00343,HB00343,Standard,Double,1,Painting truth gun attention garden medical mission.
HS00344,HB00344,Deluxe,Single,5,Many professional identify politics be two.
HS00345,HB00345,Deluxe,Single,2,Option possible change lot get.
HS00346,HB00346,Standard,Double,5,Scientist right enter deep.
HS00347,HB00347,Deluxe,King,4,Around region community financial.
HS00348,HB00348,Suite,King,4,Author task last father pick popular enjoy.
HS00349,HB00349,Standard,Double,5,Now enough agency building live together.
HS00350,HB00350,Deluxe,Single,3,Food process civil space form air.
HS00351,HB00351,Deluxe,Single,3,Society top end moment together college black around.
HS00352,HB00352,Suite,King,3,Child large wall skin bad total house.
HS00353,HB00353,Standard,Single,3,Toward room possible yet lead left day.
HS00354,HB00354,Deluxe,King,1,College morning trade policy.
HS00355,HB00355,Deluxe,Double,4,Field or gun voice late chance well community.
HS00356,HB00356,Deluxe,Single,2,Knowledge walk include scientist reality.
HS00357,HB00357,Standard,Double,5,First wind world itself also.
HS00358,HB00358,Standard,Double,1,Color us ten water name.
HS00359,HB00359,Deluxe,King,3,Certain board present quickly.
HS00360,HB00360,Suite,Single,4,Yes people catch tax find.
HS00361,HB00361,Standard,King,1,Instead every get rise past.
HS00362,HB00362,Standard,Double,3,Approach easy good room.
HS00363,HB00363,Deluxe,Single,3,Best detail address many late.
HS00364,HB00364,Deluxe,Single,4,Today general bank gun next mind.
HS00365,HB00365,Standard,King,4,Join finally every water long.
HS00366,HB00366,Standard,Double,1,Factor ten up report hour news.
HS00367,HB00367,Suite,Single,1,Far better buy health boy area.
HS00368,HB00368,Standard,Double,4,Human body large push move trial office.
HS00369,HB00369,Deluxe,Single,5,However memory up reason.
HS00370,HB00370,Standard,Double,2,Inside water pass whose bank avoid though society.
HS00371,HB00371,Standard,King,2,Raise social investment current quickly range one.
HS00372,HB00372,Deluxe,Single,5,Onto their specific.
HS00373,HB00373,Suite,King,4,Center hair return outside produce usually.
HS00374,HB00374,Deluxe,King,1,Stand affect heart by stage wife.
HS00375,HB00375,Standard,Double,4,Production bed mother suddenly government let tough.
HS00376,HB00376,Deluxe,King,3,Career and least control recently space month.
HS00377,HB00377,Standard,King,3,Past hundred word us really get.
HS00378,HB00378,Standard,Double,1,War fight oil place hand director military.
