hotel_stay_id,hotel_booking_id,room_type,bed_type,rating,review_text
HS02260,HB02260,Deluxe,Single,5,Treatment month serve case.
HS02261,HB02261,Suite,King,1,Picture act quite him woman class often.
HS02262,HB02262,Suite,Single,1,Understand meet yeah day eight sometimes.
HS02263,HB02263,Deluxe,Double,1,Most medical these senior senior sound almost.
HS02264,HB02264,Deluxe,Single,3,Student across personal member century choice child.
HS02265,HB02265,Suite,Single,1,Lot yourself child focus coach.
HS02266,HB02266,Deluxe,King,5,Collection us you back indicate.
HS02267,HB02267,Deluxe,Single,2,Buy part guess shoulder evidence open camera.
HS02268,HB02268,Standard,Double,1,True red word official sing.
HS02269,HB02269,Suite,Double,3,Couple wonder determine from street its.
HS02270,HB02270,Standard,Single,2,Difference society remain news own.
HS02271,HB02271,Standard,Single,1,Though office really water movement future.
HS02272,HB02272,Standard,Double,3,History score case front window.
HS02273,HB02273,Deluxe,King,4,Together total five some both always.
HS02274,HB02274,Standard,King,2,Job student evening simple from record.
HS02275,HB02275,Deluxe,Double,1,Wife treat authority past suffer business he.
HS02276,HB02276,Standard,King,4,Tv it why agency degree surface ready.
HS02277,HB02277,Suite,King,5,Good generation need image center thought small.
HS02278,HB02278,Standard,King,2,City pretty woman.
HS02279,HB02279,Suite,King,2,Food treat determine thing painting writer.
HS02280,HB02280,Standard,Single,4,Catch inside speak.
HS02281,HB02281,Standard,Double,3,Likely speech north.
HS02282,HB02282,Suite,Single,3,Gun modern pressure call show address.
HS02283,HB02283,Suite,King,1,Learn whatever left factor.
HS02284,HB02284,Suite,Double,3,Area learn send record imagine.
HS02285,HB02285,Standard,Single,3,Necessary student impact feeling discussion.
HS02286,HB02286,Suite,Single,1,Carry begin face truth leave child bank.
HS02287,HB02287,Suite,Double,3,Ok help partner wear deal south already.
HS02288,HB02288,Deluxe,Single,4,Agency assume red social sister simple drop.
HS02289,HB02289,Standard,King,3,Inside where message two prove factor garden include.
HS02290,HB02290,Standard,King,3,Door likely human continue standard detail year.
HS02291,HB02291,Deluxe,Single,2,Time black how.
HS02292,HB02292,Standard,Single,4,Wish force own right I catch wind cover.
HS02293,HB02293,Suite,Double,2,Speak hope poor probably ok.
HS02294,HB02294,Suite,King,4,Believe ball including.
HS02295,HB02295,Deluxe,King,2,Lead available whole walk radio.
HS02296,HB02296,Standard,Double,3,Provide economy wonder drive ask page meeting.
HS02297,HB02297,Deluxe,Double,4,Condition true six information price.
HS02298,HB02298,Deluxe,King,5,Meeting care grow suffer.
HS02299,HB02299,Standard,King,4,Second simply real news she care.
HS02300,HB02300,Suite,Double,2,Ago actually after time open language.
HS02301,HB02301,Deluxe,Single,1,Appear two opportunity.
HS02302,HB02302,Deluxe,Double,4,Church agree half deal indeed dinner term.
HS02303,HB02303,Deluxe,Double,3,Out woman stop party contain.
HS02304,HB02304,Standard,Double,4,Inside far happen.
HS02305,HB02305,Deluxe,Double,5,Campaign stand television but trip defense.
HS02306,HB02306,Standard,King,1,Just left total or attorney outside clear.
HS02307,HB02307,Suite,Double,2,Not want performance.
HS02308,HB02308,Suite,Double,3,Fund south cover like.
HS02309,HB02309,Suite,Double,2,Six ready whether citizen.
HS02310,HB02310,Suite,Double,1,Former church garden ahead morning.
HS02311,HB02311,Standard,King,3,Wear modern go Congress whether.
HS02312,HB02312,Suite,King,3,Century nearly by range coach.
HS02313,HB02313,Standard,King,3,Fine attention energy employee girl.
HS02314,HB02314,Standard,King,4,Second along general water thus drop together executive.
HS02315,HB02315,Suite,King,4,Any minute marriage short story fear mention.
HS02316,HB02316,Deluxe,Double,3,Strategy tough operation expert company night.
HS02317,HB02317,Suite,Double,1,Half common will still opportunity project Mrs.
HS02318,HB02318,Suite,Double,3,Contain data born door still prove Democrat real.
HS02319,HB02319,Standard,King,5,Build conference miss join economy serious.
HS02320,HB02320,Deluxe,Double,3,West affect really.
HS02321,HB02321,Suite,Double,1,Only dark window.
HS02322,HB02322,Standard,King,3,Expert instead whether population big.
HS02323,HB02323,Suite,Double,2,Soldier record television nature enough everything college.
HS02324,HB02324,Suite,Single,2,Order stage sister politics win.
HS02325,HB02325,Standard,King,1,Word compare four simple much.
HS02326,HB02326,Suite,Single,4,Action begin decade letter laugh.
HS02327,HB02327,Standard,Single,2,Leader leader sign environmental.
HS02328,HB02328,Suite,Double,3,Line mean old floor.
HS02329,HB02329,Deluxe,King,1,Participant keep trade behavior good ready.
HS02330,HB02330,Deluxe,Double,1,Perform heart happen city fly challenge lay.
HS02331,HB02331,Deluxe,King,3,Suggest but success.
HS02332,HB02332,Deluxe,Single,2,Never believe seek look later.
HS02333,HB02333,Deluxe,Single,5,Determine scientist figure by us.
HS02334,HB02334,Suite,Single,1,Money might develop same drop participant significant.
HS02335,HB02335,Suite,Single,2,Himself exactly marriage where.
HS02336,HB02336,Standard,Double,1,Table his concern rock purpose garden.
HS02337,HB02337,Standard,King,5,Significant contain management history.
HS02338,HB02338,Suite,King,4,Significant their according the sort.
HS02339,HB02339,Deluxe,Double,3,Recognize game open fish wind there.
HS02340,HB02340,Standard,King,1,Reason federal energy crime issue mention.
HS02341,HB02341,Standard,Double,4,System suddenly staff admit might admit home.
HS02342,HB02342,Suite,Single,1,Will event from time.
HS02343,HB02343,Standard,King,3,Drop difficult social person partner week gas.
HS02344,HB02344,Deluxe,Double,2,Support week mind fly similar.
HS02345,HB02345,Standard,King,2,Friend social direction occur determine.
HS02346,HB02346,Deluxe,King,5,Feel government loss.
HS02347,HB02347,Standard,King,1,Sure eye right factor raise nearly traditional every.
HS02348,HB02348,Standard,Single,4,Trip night before purpose.
HS02349,HB02349,Suite,King,3,Enter something body rule describe red take.
HS02350,HB02350,Deluxe,King,2,Threat born matter sound new say government.
HS02351,HB02351,Deluxe,Single,3,Institution our effect sit their under them.
HS02352,HB02352,Standard,Single,5,Source reach ten site future southern enter your.
HS02353,HB02353,Suite,Single,4,Material citizen adult south sense.
HS02354,HB02354,Suite,Single,1,Guy image city minute perhaps.
HS02355,HB02355,Standard,Single,4,Ten doctor benefit sure.
HS02356,HB02356,Deluxe,King,5,Art support phone eye agreement especially impact.
HS02357,HB02357,Deluxe,King,1,Give table become.
HS02358,HB02358,Suite,Double,4,Well cut per body management follow daughter.
HS02359,HB02359,Deluxe,Double,3,Green my fear level top perform.
HS02360,HB02360,Standard,King,3,Commercial science again its resource week.
HS02361,HB02361,Deluxe,Double,3,Hair time trip institution another line itself paper.
HS02362,HB02362,Suite,Double,1,With measure walk ago company behavior.
HS02363,HB02363,Deluxe,King,3,Bill culture town current.
HS02364,HB02364,Suite,Single,5,Fast huge clearly home.
HS02365,HB02365,Deluxe,Double,3,Talk south standard another course she rise.
HS02366,HB02366,Suite,Double,5,Than everything senior let during though production.
HS02367,HB02367,Deluxe,King,5,Health help west put.
HS02368,HB02368,Standard,Single,5,Join politics must oil wait only.
HS02369,HB02369,Deluxe,King,2,Law yeah wait party subject.
HS02370,HB02370,Deluxe,King,5,Think hope line per sign somebody artist.
HS02371,HB02371,Deluxe,Double,1,Threat threat build part similar hundred.
HS02372,HB02372,Deluxe,King,1,Dream run area out catch very.
HS02373,HB02373,Suite,Double,2,Identify serve doctor election throughout share hit.
HS02374,HB02374,Standard,Double,5,Sure mind follow pressure course.
HS02375,HB02375,Suite,King,1,Responsibility lose for news meet wall.
HS02376,HB02376,Standard,Double,1,Rock treatment consider.
HS02377,HB02377,Suite,Single,5,Need sister culture church radio direction.
HS02378,HB02378,Suite,Single,4,Day these whatever program gun everyone month.
HS02379,HB02379,Deluxe,Double,5,Level research body each they.
HS02380,HB02380,Deluxe,King,2,News so toward maybe occur employee thought.
HS02381,HB02381,Suite,Double,3,Fear discover nation large however TV.
HS02382,HB02382,Standard,Double,3,Model student mission center edge.
HS02383,HB02383,Standard,Single,1,Box similar rich share country mention.
HS02384,HB02384,Suite,Single,4,Peace past environment find middle.
HS02385,HB02385,Standard,Single,4,Accept whatever decide her country significant include.
HS02386,HB02386,Deluxe,Double,5,Usually must or deal.
HS02387,HB02387,Standard,Double,4,Total accept outside but.
HS02388,HB02388,Deluxe,Single,1,War ahead tonight between whom care into determine.
HS02389,HB02389,Standard,Single,5,Great too maintain.
HS02390,HB02390,Suite,Single,2,Subject remain large evidence individual specific.
HS02391,HB02391,Deluxe,Double,4,Every professor although far former right.
HS02392,HB02392,Suite,King,2,Alone save tonight there provide look.
HS02393,HB02393,Standard,Single,3,Suddenly garden letter.
HS02394,HB02394,Suite,Single,1,Bag whom break result little tax impact society.
HS02395,HB02395,Standard,Double,1,North officer much sign either Republican floor.
HS02396,HB02396,Suite,King,3,Already financial spend author management today serious.
HS02397,HB02397,Deluxe,Double,3,Spend try call onto beautiful study outside.
HS02398,HB02398,Standard,Single,4,Fall key blue mouth catch office.
HS02399,HB02399,Standard,Double,3,Consumer own likely admit hear good.
HS02400,HB02400,Standard,King,3,Drug difficult reveal move floor.
HS02401,HB02401,Suite,King,1,Development realize despite specific anything pull among huge.
HS02402,HB02402,Deluxe,Single,1,Fund friend feel purpose safe.
HS02403,HB02403,Standard,King,4,Theory dog space management before simple.
HS02404,HB02404,Standard,Double,4,Building same ok politics far.
HS02405,HB02405,Standard,King,4,Past scene until politics water although challenge stage.
HS02406,HB02406,Suite,Single,3,Want term special follow wife.
HS02407,HB02407,Deluxe,Double,1,Interest agency letter yet card difference role past.
HS02408,HB02408,Standard,Double,4,Toward majority seat democratic focus.
HS02409,HB02409,Standard,Single,1,Bill let believe attorney administration front over.
HS02410,HB02410,Deluxe,King,2,Design sister establish prove similar fine single behavior.
HS02411,HB02411,Deluxe,Single,3,Voice health claim appear especially property by.
HS02412,HB02412,Deluxe,Double,1,Serious garden effect state move.
HS02413,HB02413,Deluxe,King,3,Central family different result hair budget office.
HS02414,HB02414,Standard,Single,5,Today above treatment leg strong mouth.
HS02415,HB02415,Standard,Double,3,Western pattern voice.
HS02416,HB02416,Suite,King,4,Next popular democratic within arrive.
HS02417,HB02417,Suite,Single,2,South season word see.
HS02418,HB02418,Standard,Double,5,Cut inside good black.
HS02419,HB02419,Standard,King,2,Best series like will minute situation environmental pay.
HS02420,HB02420,Standard,Single,2,Say scene chair around measure support although.
HS02421,HB02421,Suite,Double,1,Floor art meeting next.
HS02422,HB02422,Suite,King,2,Model little center school offer my weight.
HS02423,HB02423,Deluxe,Single,1,Into half also model.
HS02424,HB02424,Deluxe,King,4,Station join race data dark.
HS02425,HB02425,Suite,King,5,Stop letter mean control.
HS02426,HB02426,Standard,Single,5,Let positive item high.
HS02427,HB02427,Suite,Single,2,Else able red five.
HS02428,HB02428,Deluxe,King,5,Serious once message plant push.
HS02429,HB02429,Deluxe,King,1,Fight present tend someone.
HS02430,HB02430,Deluxe,Double,2,Kid business time wear Republican help animal.
HS02431,HB02431,Standard,King,3,Make camera boy upon pay.
HS02432,HB02432,Standard,Double,1,Attack full rise shake see send.
HS02433,HB02433,Suite,King,5,Sign son watch keep account there.
HS02434,HB02434,Suite,Single,4,Position when down discover anyone.
HS02435,HB02435,Deluxe,King,2,Officer rest particular.
HS02436,HB02436,Suite,Double,4,Among enough memory student network.
HS02437,HB02437,Deluxe,King,4,Often herself deal left.
HS02438,HB02438,Suite,Double,3,Nearly foot do call.
HS02439,HB02439,Standard,King,5,Current land outside look who take.
HS02440,HB02440,Standard,King,3,He especially three relate serious anything.
HS02441,HB02441,Suite,Double,3,Eat foot mother occur civil.
HS02442,HB02442,Suite,Single,2,Resource edge eight exactly past radio.
HS02443,HB02443,Deluxe,Double,1,Particularly so like authority purpose stand.
HS02444,HB02444,Deluxe,King,2,His enjoy health special.
HS02445,HB02445,Standard,Single,2,Rich miss avoid image structure.
HS02446,HB02446,Suite,Single,4,Two recognize record sport back.
HS02447,HB02447,Suite,Single,2,Describe risk last address.
HS02448,HB02448,Standard,Single,4,Including couple finish front accept little cost.
HS02449,HB02449,Deluxe,Double,2,Apply cup great ball.
HS02450,HB02450,Deluxe,Double,2,During beat word human both.
HS02451,HB02451,Standard,Double,5,Group help like purpose more task officer.
HS02452,HB02452,Suite,Single,1,Check two company safe land former.
HS02453,HB02453,Deluxe,Double,1,Forget check loss more.
HS02454,HB02454,Standard,King,3,Close heavy on its.
HS02455,HB02455,Deluxe,Single,3,Provide quickly part.
HS02456,HB02456,Standard,Single,4,American dog throw tree.
HS02457,HB02457,Standard,Single,3,Professor participant mother avoid discover ok past star.
HS02458,HB02458,Standard,Single,4,Week each range seek point expect unit doctor.
HS02459,HB02459,Standard,King,2,Music never address article term rest could already.
HS02460,HB02460,Standard,King,3,Information western everybody discover start current third gas.
HS02461,HB02461,Deluxe,King,3,Kid anything past owner look.
HS02462,HB02462,Standard,Single,3,End probably even purpose world prepare choice.
HS02463,HB02463,Suite,Double,3,Little culture relate wait mention.
HS02464,HB02464,Suite,King,1,Himself return cultural not through.
HS02465,HB02465,Suite,Single,1,Year play today above its.
HS02466,HB02466,Deluxe,Single,1,Language in per sign.
HS02467,HB02467,Suite,Single,4,Number help ability baby condition place.
HS02468,HB02468,Deluxe,Single,5,Gun during tax herself much owner.
HS02469,HB02469,Deluxe,Double,1,Specific lot view factor Democrat room Republican.
HS02470,HB02470,Suite,Single,2,Movie me policy care radio.
HS02471,HB02471,Standard,Single,3,Reveal chair cup computer data none should.
HS02472,HB02472,Suite,Single,4,See change professor report.
HS02473,HB02473,Deluxe,Single,5,Friend budget recently executive door.
HS02474,HB02474,Suite,Double,2,Religious husband main central clear.
HS02475,HB02475,Deluxe,King,2,Must feeling phone character fine simply stock.
HS02476,HB02476,Suite,King,3,Next push quite structure himself.
HS02477,HB02477,Deluxe,King,5,But author admit fight between range.
HS02478,HB02478,Standard,King,3,Remember strong second executive artist between.
HS02479,HB02479,Deluxe,Single,2,Force pattern fall available strategy build board mouth.
HS02480,HB02480,Standard,Double,5,Where its yard although sit mission radio.
HS02481,HB02481,Deluxe,King,3,Author building common Mrs focus floor.
HS02482,HB02482,Suite,Double,4,Hot economic with up center tonight line.
HS02483,HB02483,Suite,King,4,Democratic us song bit certainly force.
HS02484,HB02484,Deluxe,Single,5,Make region turn.
HS02485,HB02485,Standard,King,3,Too join number TV.
HS02486,HB02486,Deluxe,Double,1,Travel past writer card all.
HS02487,HB02487,Deluxe,King,1,Country unit important coach buy open.
HS02488,HB02488,Suite,King,3,High professional piece report sea whose continue run.
HS02489,HB02489,Deluxe,King,3,Use woman property thought foreign car before.
HS02490,HB02490,Deluxe,King,5,Somebody country because three song.
HS02491,HB02491,Suite,King,3,Although offer call amount.
HS02492,HB02492,Standard,King,1,High star choice head trial indicate.
HS02493,HB02493,Suite,King,4,Sign store over our four you now throughout.
HS02494,HB02494,Suite,Single,4,Themselves describe letter three high figure.
HS02495,HB02495,Deluxe,Double,4,Easy high serve specific try I.
HS02496,HB02496,Suite,Double,2,Set response general foot thing.
HS02497,HB02497,Standard,King,3,Name significant idea.
HS02498,HB02498,Suite,Double,4,Her apply message your simply win beautiful.
HS02499,HB02499,Deluxe,Single,4,Child many dream five his their manager.
HS02500,HB02500,Standard,Double,1,Dog follow any notice.
HS02501,HB02501,Suite,Single,3,Peace people room tough way still value.
HS02502,HB02502,Suite,King,3,Watch then until rather.
HS02503,HB02503,Deluxe,Double,3,Either various thus art cultural kind again.
HS02504,HB02504,Standard,Double,2,Drive that determine top.
HS02505,HB02505,Standard,King,4,Parent truth strong form evidence message.
HS02506,HB02506,Standard,King,2,Piece poor bed rate.
HS02507,HB02507,Standard,King,4,Card court maybe fly black growth tend this.
HS02508,HB02508,Deluxe,Double,4,Drive image voice rest throw agree five surface.
HS02509,HB02509,Deluxe,Double,2,What report tell food economy base.
HS02510,HB02510,Deluxe,Single,3,Ever total young into seat peace meet respond.
HS02511,HB02511,Deluxe,Single,3,Edge dog sound.
HS02512,HB02512,Deluxe,Single,2,Before nation conference catch discussion attention special.
HS02513,HB02513,Standard,King,3,Allow cost serve walk.
HS02514,HB02514,Suite,Single,1,Science piece from enjoy enter.
HS02515,HB02515,Deluxe,King,1,Here sort possible his third.
HS02516,HB02516,Standard,Single,1,Or state teach air.
HS02517,HB02517,Deluxe,Double,4,Chair parent finish spend defense scene voice.
HS02518,HB02518,Standard,King,1,During can action generation may.
HS02519,HB02519,Suite,Double,4,If true growth language son gun manage.
HS02520,HB02520,Suite,Single,1,Appear claim attack admit most follow bring network.
HS02521,HB02521,Deluxe,Single,4,Mean figure draw Congress mother suggest interview example.
HS02522,HB02522,Deluxe,King,5,Away each last pretty before.
HS02523,HB02523,Standard,Single,1,Car into cup why news staff.
HS02524,HB02524,Deluxe,King,5,All break task simple speech student.
HS02525,HB02525,Standard,King,3,Total including production carry shake know her tree.
HS02526,HB02526,Suite,King,1,Manage story ago Congress ability lay sometimes itself.
HS02527,HB02527,Deluxe,Double,4,Pay customer discussion.
HS02528,HB02528,Deluxe,King,4,Community character mother.
HS02529,HB02529,Standard,Double,3,Political option company who.
HS02530,HB02530,Standard,Single,3,Step drive person early sense week.
HS02531,HB02531,Suite,King,3,Two base might.
HS02532,HB02532,Suite,Double,3,Together green once air various.
HS02533,HB02533,Deluxe,Double,2,Owner alone lay art blood.
HS02534,HB02534,Suite,King,3,Deep walk floor sister more city.
HS02535,HB02535,Deluxe,Double,1,Agency role wind fill surface.
HS02536,HB02536,Suite,Single,5,Situation everybody house trial according street.
HS02537,HB02537,Deluxe,Single,1,Place change just leave natural.
HS02538,HB02538,Suite,Single,2,High heart within responsibility address.
HS02539,HB02539,Deluxe,King,5,Establish push care if brother cultural.
HS02540,HB02540,Suite,King,4,Social culture size summer ok more.
HS02541,HB02541,Standard,Single,3,Wall whatever speech food feel model anyone.
HS02542,HB02542,Standard,Double,5,Worker yourself never bank herself only market computer.
HS02543,HB02543,Suite,King,4,Song once perhaps realize before almost your energy.
HS02544,HB02544,Suite,Single,5,Research just civil.
HS02545,HB02545,Standard,Single,5,Senior sea leg there common.
HS02546,HB02546,Standard,Single,4,Perform example production later.
HS02547,HB02547,Deluxe,Single,5,Garden fight admit garden receive.
HS02548,HB02548,Standard,Single,5,Adult teacher over.
HS02549,HB02549,Suite,King,5,Success during field policy certainly product.
HS02550,HB02550,Standard,King,3,Already production rise build start before.
HS02551,HB02551,Standard,Single,5,Look whatever amount mother paper especially several serious.
HS02552,HB02552,Standard,Single,5,Front agreement hand police remain discover push.
HS02553,HB02553,Standard,King,1,True memory again success.
HS02554,HB02554,Suite,King,2,Other easy alone soon rate center.
HS02555,HB02555,Suite,Single,4,Else room rest green ten.
HS02556,HB02556,Standard,Single,4,Current drive every.
HS02557,HB02557,Standard,King,5,That education major watch quite exactly it.
HS02558,HB02558,Suite,Single,3,On her behind decide certain challenge college.
HS02559,HB02559,Suite,Single,3,Point just control out provide industry near.
HS02560,HB02560,Standard,Double,2,Though small assume speak race.
HS02561,HB02561,Standard,King,1,Upon data happen read personal.
HS02562,HB02562,Standard,Single,5,Sure evening gas grow letter young ability population.
HS02563,HB02563,Standard,Single,4,Say yourself us.
HS02564,HB02564,Suite,Double,1,Debate ok allow brother still foot write.
HS02565,HB02565,Suite,King,1,While fund music draw myself.
HS02566,HB02566,Standard,Double,4,Morning rich meeting employee.
HS02567,HB02567,Standard,King,3,Road pay public go few save.
HS02568,HB02568,Suite,Double,2,Capital front quite hold medical power.
HS02569,HB02569,Deluxe,Double,2,Check federal car shoulder early try right accept.
HS02570,HB02570,Standard,Double,5,Parent chair truth a a power.
HS02571,HB02571,Deluxe,King,4,Development sort few.
HS02572,HB02572,Deluxe,Double,2,East white music tree citizen one alone.
HS02573,HB02573,Suite,Double,1,Ago best summer.
HS02574,HB02574,Deluxe,Single,3,Teacher job little.
HS02575,HB02575,Standard,Double,3,Newspaper letter never also student church here billion.
HS02576,HB02576,Deluxe,King,4,Kind make how much.
HS02577,HB02577,Deluxe,Single,1,Answer six to design day.
HS02578,HB02578,Standard,King,4,Executive least rise we technology enter fall member.
HS02579,HB02579,Standard,Double,5,Free according least spend president.
HS02580,HB02580,Deluxe,Single,1,Record financial lose begin play.
HS02581,HB02581,Standard,King,4,House road common determine use effort.
HS02582,HB02582,Standard,King,4,Up could woman either determine.
HS02583,HB02583,Deluxe,Single,5,Store yard air know bag.
HS02584,HB02584,Standard,King,5,Try offer hot check mouth leave.
HS02585,HB02585,Deluxe,King,2,Animal little response study station.
HS02586,HB02586,Deluxe,Single,4,Way fish reveal any line thought war.
HS02587,HB02587,Suite,Single,3,Degree could factor.
HS02588,HB02588,Deluxe,Single,3,International office like.
HS02589,HB02589,Suite,Double,1,Final clearly significant mother everyone bank.
HS02590,HB02590,Standard,Double,4,If group nature reflect not.
HS02591,HB02591,Suite,Single,1,Computer thousand sport issue.
HS02592,HB02592,Deluxe,King,4,Agree among wait rather nearly read pass.
HS02593,HB02593,Suite,Single,1,Economic evidence yes value young.
HS02594,HB02594,Deluxe,Double,1,Others after recently wrong help.
HS02595,HB02595,Standard,King,4,Cell perhaps eat.
HS02596,HB02596,Deluxe,Single,5,Near difference see ever best agency.
HS02597,HB02597,Suite,King,1,Any size during hand nation sound student trip.
HS02598,HB02598,Suite,Double,2,Live significant somebody situation.
HS02599,HB02599,Deluxe,Single,5,Current throughout perhaps trouble plant last big.
HS02600,HB02600,Deluxe,King,4,Main participant type.
HS02601,HB02601,Deluxe,Double,3,Grow man thing hundred consumer low.
HS02602,HB02602,Deluxe,King,3,Whole politics money old gas.
HS02603,HB02603,Standard,King,5,Body many lose range discussion yes sister often.
HS02604,HB02604,Standard,Double,4,Specific cell baby price however data.
HS02605,HB02605,Suite,Single,1,Organization popular open we beautiful poor.
HS02606,HB02606,Deluxe,Single,3,Seat special market area cold like.
HS02607,HB02607,Suite,Double,1,Garden cover customer without.
HS02608,HB02608,Standard,Single,2,Them term easy across herself.
HS02609,HB02609,Deluxe,King,3,Who during set standard.
HS02610,HB02610,Suite,Double,4,Professional capital less audience picture might behavior.
HS02611,HB02611,Suite,King,4,Each itself fill too.
HS02612,HB02612,Deluxe,Double,3,Region research cultural send huge there according.
HS02613,HB02613,Standard,Single,1,Wall several budget truth hair.
HS02614,HB02614,Deluxe,Double,1,Discover pretty its actually soldier policy wonder.
HS02615,HB02615,Suite,King,4,Mind yet herself person.
HS02616,HB02616,Standard,King,5,Mean impact situation then wide leader across boy.
HS02617,HB02617,Standard,King,1,Per suffer film rich glass main key.
HS02618,HB02618,Standard,King,5,Cell area relate.
HS02619,HB02619,Deluxe,King,3,Form heart prove play.
HS02620,HB02620,Suite,King,4,Modern way price leg discover this clear hot.
HS02621,HB02621,Suite,Single,3,Lot into arrive.
HS02622,HB02622,Suite,Double,3,Respond market decision learn data.
HS02623,HB02623,Suite,Single,1,Current animal whatever impact chair.
HS02624,HB02624,Deluxe,Single,4,Sign American tend great.
HS02625,HB02625,Suite,Double,3,Increase cell night cost put.
HS02626,HB02626,Deluxe,Single,5,Audience around less quite.
HS02627,HB02627,Standard,King,2,Color herself could better.
HS02628,HB02628,Suite,Single,5,System Mrs wrong school school.
HS02629,HB02629,Deluxe,King,1,Level beautiful face spring southern agency.
HS02630,HB02630,Suite,King,2,Once road even quite song fear reduce.
HS02631,HB02631,Standard,Single,3,Property study into successful detail third history.
HS02632,HB02632,Deluxe,Single,1,Career quite too entire drop.
HS02633,HB02633,Standard,Single,1,Rise four she model.
HS02634,HB02634,Suite,King,2,Medical watch billion while sure industry.
HS02635,HB02635,Standard,Double,3,Enter question evening water election wish.
HS02636,HB02636,Suite,Double,3,Civil billion feel life I choice difference.
HS02637,HB02637,Deluxe,King,3,Less at political reach story significant already.
